Archivos Entregados
===================

[ 192]  .
|-- [4.6K]  Enunciado.md
|-- [1.8K]  README.md
|-- [  25]  ejemplos
|   `-- [ 164]  pokedex.csv
|-- [ 171]  img
|   |-- [ 32K]  algo2.svg
|   |-- [ 19K]  diagrama1.svg
|   |-- [9.9K]  diagrama2.svg
|   |-- [ 10K]  pruebas_esperado.jpg
|   |-- [ 11K]  pruebas_esperado_mas_3_elem.jpg
|   `-- [ 11K]  pruebas_esperado_sin_5_elem.jpg
|-- [ 68K]  log_abb.txt
|-- [ 740]  makefile
|-- [1.3K]  pa2m.h
|-- [ 56K]  pruebas_alumno
|-- [8.9K]  pruebas_alumno.c
|-- [ 134]  src
|   |-- [6.7K]  abb.c
|   |-- [1.8K]  abb.h
|   |-- [ 388]  abb_estructura_privada.h
|   |-- [4.0K]  abb_internas.c
|   |-- [ 745]  abb_internas.h
|   |-- [1.7K]  csv.c
|   `-- [1.2K]  csv.h
`-- [4.8K]  tp_abb.c

4 directories, 22 files

[1;35mLinter
======
[0m
[1;32mLINTER OK[0m

[1;35mCompilación y pruebas
========================[0m
rm -f *.o pruebas_chanutron pruebas_alumno tp-abb
gcc -std=c99 -Wall -Wconversion -Wtype-limits -pedantic  -O2 -g src/*.c pruebas_chanutron.c pruebas_aux.c -o pruebas_chanutron
rm -f pruebas_chanutron.c pruebas_aux.c pruebas_abb.c
valgrind --leak-check=full --track-origins=yes --show-reachable=yes --error-exitcode=2 --show-leak-kinds=all --trace-children=yes ./pruebas_chanutron
==13574== Memcheck, a memory error detector
==13574== Copyright (C) 2002-2022, and GNU GPL'd, by Julian Seward et al.
==13574== Using Valgrind-3.22.0 and LibVEX; rerun with -h for copyright info
==13574== Command: ./pruebas_chanutron
==13574== 
[33;1m
Pruebas de creación de ABB
===========================[37;1m
[32;1m✓ [37;1mSe puede crear un abb
[32;1m✓ [37;1mEl abb se crea vacío
[32;1m✓ [37;1mLa cantidad de elementos es cero
[32;1m✓ [37;1mEl elemento raíz es NULL
==13575== 
==13575== HEAP SUMMARY:
==13575==     in use at exit: 0 bytes in 0 blocks
==13575==   total heap usage: 2 allocs, 2 frees, 4,120 bytes allocated
==13575== 
==13575== All heap blocks were freed -- no leaks are possible
==13575== 
==13575== For lists of detected and suppressed errors, rerun with: -s
==13575== ERROR SUMMARY: 0 errors from 0 contexts (suppressed: 0 from 0)
[33;1m
Pruebas de inserción
=====================[37;1m
[32;1m✓ [37;1mPuedo insertar un elemento en el abb.
[32;1m✓ [37;1mEl elemento queda como valor raíz
[32;1m✓ [37;1mEl abb ya no está vacío.
[32;1m✓ [37;1mLa cantidad de elementos es 1
[32;1m✓ [37;1mPuedo insertar un elemento menor que el primero.
[32;1m✓ [37;1mEl abb queda con un hijo izquierdo y sin hijo derecho.
[32;1m✓ [37;1mEl elemento queda a la izquierda de la raíz.
[32;1m✓ [37;1mLa cantidad de elementos es 2
[32;1m✓ [37;1mPuedo insertar un elemento mayor que el primero.
[32;1m✓ [37;1mEl abb queda con un hijo izquierdo y un hijo derecho.
[32;1m✓ [37;1mEl elemento queda a la derecha de la raíz.
[32;1m✓ [37;1mLa cantidad de elementos es 3
[32;1m✓ [37;1mLos tres elementos se encuentran en las posiciones esperadas.
[32;1m✓ [37;1mPuedo insertar un elemento menor a los que estaban.
[32;1m✓ [37;1mEl hijo izquierdo del raíz ahora tiene un hijo izquierdo.
[32;1m✓ [37;1mEl elemento tiene el valor esperado.
[32;1m✓ [37;1mLa cantidad de elementos es 4
[32;1m✓ [37;1mPuedo insertar un elemento mayor a los que estaban.
[32;1m✓ [37;1mEl hijo derecho del raíz ahora tiene un hijo derecho.
[32;1m✓ [37;1mEl elemento tiene el valor esperado.
[32;1m✓ [37;1mLa cantidad de elementos es 5
==13576== 
==13576== HEAP SUMMARY:
==13576==     in use at exit: 0 bytes in 0 blocks
==13576==   total heap usage: 7 allocs, 7 frees, 4,240 bytes allocated
==13576== 
==13576== All heap blocks were freed -- no leaks are possible
==13576== 
==13576== For lists of detected and suppressed errors, rerun with: -s
==13576== ERROR SUMMARY: 0 errors from 0 contexts (suppressed: 0 from 0)
[33;1m
Pruebas de búsqueda
====================[37;1m
[32;1m✓ [37;1mBusco un elemento existente y lo encuentro
[32;1m✓ [37;1mBusco un elemento existente y lo encuentro
[32;1m✓ [37;1mBusco un elemento existente y lo encuentro
[32;1m✓ [37;1mBusco un elemento existente y lo encuentro
[32;1m✓ [37;1mBusco un elemento existente y lo encuentro
[32;1m✓ [37;1mBusco un elemento existente y lo encuentro
[32;1m✓ [37;1mBusco un elemento existente y lo encuentro
[32;1m✓ [37;1mBusco un elemento existente y lo encuentro
[32;1m✓ [37;1mBusco un elemento existente y lo encuentro
[32;1m✓ [37;1mBusco un elemento existente y lo encuentro
[32;1m✓ [37;1mBuscar un elemento inexistente devuelve NULL.
==13577== 
==13577== HEAP SUMMARY:
==13577==     in use at exit: 0 bytes in 0 blocks
==13577==   total heap usage: 12 allocs, 12 frees, 4,360 bytes allocated
==13577== 
==13577== All heap blocks were freed -- no leaks are possible
==13577== 
==13577== For lists of detected and suppressed errors, rerun with: -s
==13577== ERROR SUMMARY: 0 errors from 0 contexts (suppressed: 0 from 0)
[33;1m
Pruebas de borrado
==================[37;1m
[32;1m✓ [37;1mPuedo borrar un nodo hoja
[32;1m✓ [37;1mEl elemento devuelto es el esperado (0x1fff0004d8 == 0x1fff0004d8).
[32;1m✓ [37;1mEl nodo eliminado no existe mas.
[32;1m✓ [37;1mLa cantidad de elementos es 6
[32;1m✓ [37;1mPuedo borrar un nodo no hoja con un hijo.
[32;1m✓ [37;1mEl elemento devuelto es el esperado (0x1fff0004c8 == 0x1fff0004c8).
[32;1m✓ [37;1mEl nodo que queda en su lugar es el nodo hijo.
[32;1m✓ [37;1mLa cantidad de elementos es 5
[32;1m✓ [37;1mPuedo borrar un nodo con dos hijos.
[32;1m✓ [37;1mEl elemento devuelto es el esperado (0x1fff0004d0 == 0x1fff0004d0).
[32;1m✓ [37;1mEl nodo que queda en su lugar es el predecesor inorden ¯\_(ツ)_/¯ .
[32;1m✓ [37;1mPuedo borrar el nodo raíz (con dos hijos).
[32;1m✓ [37;1mEl elemento devuelto es el esperado (0x1fff0004c0 == 0x1fff0004c0).
[32;1m✓ [37;1mEl nodo que queda en su lugar es el predecesor inorden ¯\_(ツ)_/¯ .
[32;1m✓ [37;1mLa cantidad de elementos es 3
[32;1m✓ [37;1mA la izquierda de la raíz queda el elemento esperado.
[32;1m✓ [37;1mA la derecha de la raíz queda el elemento esperado.
[32;1m✓ [37;1mPuedo borrar el nodo raíz (con un hijo).
[32;1m✓ [37;1mEl elemento devuelto es el esperado (0x1fff0004e8 == 0x1fff0004e8).
[32;1m✓ [37;1mEl nodo que queda en su lugar es el unico hijo.
[32;1m✓ [37;1mA la izquierda de la raíz queda el elemento esperado.
[32;1m✓ [37;1mA la derecha de la raíz queda el elemento esperado.
[32;1m✓ [37;1mPuedo borrar otro nodo hoja.
[32;1m✓ [37;1mEl elemento devuelto es el esperado (0x1fff0004e0 == 0x1fff0004e0).
[32;1m✓ [37;1mA la izquierda de la raíz queda el elemento esperado.
[32;1m✓ [37;1mA la derecha de la raíz queda el elemento esperado.
[32;1m✓ [37;1mPuedo borrar el nodo raíz (sin hijos).
[32;1m✓ [37;1mEl elemento devuelto es el esperado (0x1fff0004f0 == 0x1fff0004f0).
[32;1m✓ [37;1mLa cantidad de elementos es 0
[32;1m✓ [37;1mNo queda nadie en la raíz, abb vacío.
[32;1m✓ [37;1mLa funcion abb_vacio devuelve true.
==13578== 
==13578== HEAP SUMMARY:
==13578==     in use at exit: 0 bytes in 0 blocks
==13578==   total heap usage: 9 allocs, 9 frees, 4,288 bytes allocated
==13578== 
==13578== All heap blocks were freed -- no leaks are possible
==13578== 
==13578== For lists of detected and suppressed errors, rerun with: -s
==13578== ERROR SUMMARY: 0 errors from 0 contexts (suppressed: 0 from 0)
[33;1m
Pruebas de borrado (siempre borra la raíz)
===========================================[37;1m
[32;1m✓ [37;1mPuedo borrar la raíz del abb.
[32;1m✓ [37;1mEl elemento devuelto es el esperado (0x1fff0004a0 == 0x1fff0004a0).
[31;1m✗ [37;1mEl elemento que queda en la raíz es el predecesor inorden ¯\_(ツ)_/¯ .
[31;1m✗ [37;1mPuedo borrar la raíz del abb.
[31;1m✗ [37;1mEl elemento devuelto es el esperado (0x1fff0004a0 == 0x1fff0004e8).
[32;1m✓ [37;1mEl elemento que queda en la raíz es el predecesor inorden ¯\_(ツ)_/¯ .
[32;1m✓ [37;1mPuedo borrar la raíz del abb.
[32;1m✓ [37;1mEl elemento devuelto es el esperado (0x1fff0004e0 == 0x1fff0004e0).
[32;1m✓ [37;1mEl elemento que queda en la raíz es el predecesor inorden ¯\_(ツ)_/¯ .
[31;1m✗ [37;1mLa cantidad de elementos es 7 (8 == 7).
[32;1m✓ [37;1mPude eliminar todos los elementos restantes del abb siempre borrando la raíz.
[31;1m✗ [37;1mEl abb queda vacío.
==13579== 
==13579== HEAP SUMMARY:
==13579==     in use at exit: 24 bytes in 1 blocks
==13579==   total heap usage: 12 allocs, 11 frees, 4,360 bytes allocated
==13579== 
==13579== 24 bytes in 1 blocks are definitely lost in loss record 1 of 1
==13579==    at 0x484D953: calloc (in /usr/libexec/valgrind/vgpreload_memcheck-amd64-linux.so)
==13579==    by 0x10A13B: crear_nodo (abb_internas.c:6)
==13579==    by 0x10A13B: interna_insertar (abb_internas.c:19)
==13579==    by 0x1099DC: abb_insertar (abb.c:47)
==13579==    by 0x10E02E: probar_borrado_abb_raiz (pruebas_chanutron.c:328)
==13579==    by 0x1097F4: main (pruebas_chanutron.c:694)
==13579== 
==13579== LEAK SUMMARY:
==13579==    definitely lost: 24 bytes in 1 blocks
==13579==    indirectly lost: 0 bytes in 0 blocks
==13579==      possibly lost: 0 bytes in 0 blocks
==13579==    still reachable: 0 bytes in 0 blocks
==13579==         suppressed: 0 bytes in 0 blocks
==13579== 
==13579== For lists of detected and suppressed errors, rerun with: -s
==13579== ERROR SUMMARY: 1 errors from 1 contexts (suppressed: 0 from 0)
[33;1m
Pruebas de insertar/eliminar/buscar
===================================[37;1m
[32;1m✓ [37;1mBorro la raiz del abb.
[32;1m✓ [37;1mEl elemento devuelto es el esperado (0x1fff0004a0 == 0x1fff0004a0).
[32;1m✓ [37;1mEl elemento no existe mas en el abb.
[32;1m✓ [37;1mPuedo volver a insertar el elemento.
[32;1m✓ [37;1mEl elemento existe en el abb y puedo buscarlo.
[32;1m✓ [37;1mBorro la raiz del abb.
[32;1m✓ [37;1mEl elemento devuelto es el esperado (0x1fff0004c8 == 0x1fff0004c8).
[32;1m✓ [37;1mEl elemento no existe mas en el abb.
[32;1m✓ [37;1mPuedo volver a insertar el elemento.
[32;1m✓ [37;1mEl elemento existe en el abb y puedo buscarlo.
[32;1m✓ [37;1mBorro la raiz del abb.
[32;1m✓ [37;1mEl elemento devuelto es el esperado (0x1fff0004b8 == 0x1fff0004b8).
[32;1m✓ [37;1mEl elemento no existe mas en el abb.
[32;1m✓ [37;1mPuedo volver a insertar el elemento.
[32;1m✓ [37;1mEl elemento existe en el abb y puedo buscarlo.
[32;1m✓ [37;1mBorro la raiz del abb.
[32;1m✓ [37;1mEl elemento devuelto es el esperado (0x1fff0004a8 == 0x1fff0004a8).
[32;1m✓ [37;1mEl elemento no existe mas en el abb.
[32;1m✓ [37;1mPuedo volver a insertar el elemento.
[32;1m✓ [37;1mEl elemento existe en el abb y puedo buscarlo.
[32;1m✓ [37;1mBorro la raiz del abb.
[32;1m✓ [37;1mEl elemento devuelto es el esperado (0x1fff0004b0 == 0x1fff0004b0).
[32;1m✓ [37;1mEl elemento no existe mas en el abb.
[32;1m✓ [37;1mPuedo volver a insertar el elemento.
[32;1m✓ [37;1mEl elemento existe en el abb y puedo buscarlo.
[32;1m✓ [37;1mSe puede eliminar todos los elementos del abb sin problemas.
[32;1m✓ [37;1mEl abb queda con 0 elementos (0).
[32;1m✓ [37;1mSe pueden volver a insertar elementos en el abb (0 inserciones fallidas).
[32;1m✓ [37;1mBusco un elemento y lo encuentro
[32;1m✓ [37;1mBusco un elemento y lo encuentro
[32;1m✓ [37;1mBusco un elemento y lo encuentro
==13580== 
==13580== HEAP SUMMARY:
==13580==     in use at exit: 0 bytes in 0 blocks
==13580==   total heap usage: 27 allocs, 27 frees, 4,720 bytes allocated
==13580== 
==13580== All heap blocks were freed -- no leaks are possible
==13580== 
==13580== For lists of detected and suppressed errors, rerun with: -s
==13580== ERROR SUMMARY: 0 errors from 0 contexts (suppressed: 0 from 0)
[33;1m
Pruebas de destructor
=====================[37;1m
==13581== Invalid write of size 8
==13581==    at 0x109C6F: abb_quitar (abb.c:136)
==13581==    by 0x10EA78: probar_destructor_abb (pruebas_chanutron.c:389)
==13581==    by 0x1097B0: main (pruebas_chanutron.c:700)
==13581==  Address 0x0 is not stack'd, malloc'd or (recently) free'd
==13581== 
[31;1m

FINALIZACION ANORMAL DE LAS PRUEBAS

[37;1m==13581== 
==13581== HEAP SUMMARY:
==13581==     in use at exit: 312 bytes in 13 blocks
==13581==   total heap usage: 14 allocs, 1 frees, 4,408 bytes allocated
==13581== 
==13581== 24 bytes in 1 blocks are still reachable in loss record 1 of 2
==13581==    at 0x484D953: calloc (in /usr/libexec/valgrind/vgpreload_memcheck-amd64-linux.so)
==13581==    by 0x10993B: abb_crear (abb.c:12)
==13581==    by 0x10EA01: probar_destructor_abb (pruebas_chanutron.c:380)
==13581==    by 0x1097B0: main (pruebas_chanutron.c:700)
==13581== 
==13581== 288 bytes in 12 blocks are still reachable in loss record 2 of 2
==13581==    at 0x484D953: calloc (in /usr/libexec/valgrind/vgpreload_memcheck-amd64-linux.so)
==13581==    by 0x10A13B: crear_nodo (abb_internas.c:6)
==13581==    by 0x10A13B: interna_insertar (abb_internas.c:19)
==13581==    by 0x1099DC: abb_insertar (abb.c:47)
==13581==    by 0x10EA66: probar_destructor_abb (pruebas_chanutron.c:387)
==13581==    by 0x1097B0: main (pruebas_chanutron.c:700)
==13581== 
==13581== LEAK SUMMARY:
==13581==    definitely lost: 0 bytes in 0 blocks
==13581==    indirectly lost: 0 bytes in 0 blocks
==13581==      possibly lost: 0 bytes in 0 blocks
==13581==    still reachable: 312 bytes in 13 blocks
==13581==         suppressed: 0 bytes in 0 blocks
==13581== 
==13581== For lists of detected and suppressed errors, rerun with: -s
==13581== ERROR SUMMARY: 1 errors from 1 contexts (suppressed: 0 from 0)
[33;1m
Pruebas de recorridos e iterador interno
========================================[37;1m
[33;1m
Recorrido inorden
=================[37;1m
[32;1m✓ [37;1mLa función de recorrido devuelve la cantidad de elementos esperados
[32;1m✓ [37;1mLos elementos en el vector tienen el orden esperado.
[32;1m✓ [37;1mPido recorrer menos elementos de los existentes para hacer el recorrido.
[32;1m✓ [37;1mLos elementos en el vector tienen el orden y cantidad esperado.
[32;1m✓ [37;1mPido recorrer mas elementos de los existentes para hacer el recorrido.
[32;1m✓ [37;1mLos elementos en el vector tienen el orden y cantidad esperado.
[33;1m
Recorrido preorden
==================[37;1m
[32;1m✓ [37;1mLa función de recorrido devuelve la cantidad de elementos esperados
[32;1m✓ [37;1mLos elementos en el vector tienen el orden esperado.
[32;1m✓ [37;1mPido recorrer menos elementos de los existentes para hacer el recorrido.
[32;1m✓ [37;1mLos elementos en el vector tienen el orden y cantidad esperado.
[32;1m✓ [37;1mPido recorrer mas elementos de los existentes para hacer el recorrido.
[32;1m✓ [37;1mLos elementos en el vector tienen el orden y cantidad esperado.
[33;1m
Recorrido postorden
===================[37;1m
[32;1m✓ [37;1mLa función de recorrido devuelve la cantidad de elementos esperados
[32;1m✓ [37;1mLos elementos en el vector tienen el orden esperado.
[32;1m✓ [37;1mPido recorrer menos elementos de los existentes para hacer el recorrido.
[32;1m✓ [37;1mLos elementos en el vector tienen el orden y cantidad esperado.
[32;1m✓ [37;1mPido recorrer mas elementos de los existentes para hacer el recorrido.
[32;1m✓ [37;1mLos elementos en el vector tienen el orden y cantidad esperado.
[33;1m
Iterador interno inorden
========================[37;1m
[32;1m✓ [37;1mEl iterador interno devuelve la cantidad de elementos que se esperaba iterar.
[32;1m✓ [37;1mSe invocó la función la cantidad de veces esperada.
[32;1m✓ [37;1mSe recorrieron las claves en el orden esperado.
[31;1m✗ [37;1mCuando la función devuelve false, deja de iterar y devuelve la cantidad correcta.
[31;1m✗ [37;1mSe invocó la función de iteracion la cantidad de veces esperada.
[33;1m
Iterador interno preorden
=========================[37;1m
[32;1m✓ [37;1mEl iterador interno devuelve la cantidad de elementos que se esperaba iterar.
[32;1m✓ [37;1mSe invocó la función la cantidad de veces esperada.
[32;1m✓ [37;1mSe recorrieron las claves en el orden esperado.
[31;1m✗ [37;1mCuando la función devuelve false, deja de iterar y devuelve la cantidad correcta.
[31;1m✗ [37;1mSe invocó la función de iteracion la cantidad de veces esperada.
[33;1m
Iterador interno postorden
==========================[37;1m
[32;1m✓ [37;1mEl iterador interno devuelve la cantidad de elementos que se esperaba iterar.
[32;1m✓ [37;1mSe invocó la función la cantidad de veces esperada.
[32;1m✓ [37;1mSe recorrieron las claves en el orden esperado.
[31;1m✗ [37;1mCuando la función devuelve false, deja de iterar y devuelve la cantidad correcta.
[31;1m✗ [37;1mSe invocó la función de iteracion la cantidad de veces esperada.
==13582== 
==13582== HEAP SUMMARY:
==13582==     in use at exit: 0 bytes in 0 blocks
==13582==   total heap usage: 14 allocs, 14 frees, 4,408 bytes allocated
==13582== 
==13582== All heap blocks were freed -- no leaks are possible
==13582== 
==13582== For lists of detected and suppressed errors, rerun with: -s
==13582== ERROR SUMMARY: 0 errors from 0 contexts (suppressed: 0 from 0)
[33;1m
Pruebas con NULL
================[37;1m
==13583== Invalid read of size 8
==13583==    at 0x109E18: abb_iterar_inorden (abb.c:192)
==13583==    by 0x1101B5: probar_null_abb (pruebas_chanutron.c:589)
==13583==    by 0x1097C2: main (pruebas_chanutron.c:705)
==13583==  Address 0x8 is not stack'd, malloc'd or (recently) free'd
==13583== 
[32;1m✓ [37;1mNo puedo insertar nada en un abb nulo.
[32;1m✓ [37;1mNo puedo buscar nada en un abb nulo.
[32;1m✓ [37;1mNo puedo borrar nada de en un abb nulo.
[32;1m✓ [37;1mUn abb nulo es vacío.
[32;1m✓ [37;1mLa cantidad de elementos de un abb NULL es 0
[31;1m

ERROR MIENTRAS SE EJECUTABA LA PRUEBA: [33;1m'No puedo iterar un abb nulo.'

[37;1m==13583== 
==13583== HEAP SUMMARY:
==13583==     in use at exit: 0 bytes in 0 blocks
==13583==   total heap usage: 1 allocs, 1 frees, 4,096 bytes allocated
==13583== 
==13583== All heap blocks were freed -- no leaks are possible
==13583== 
==13583== For lists of detected and suppressed errors, rerun with: -s
==13583== ERROR SUMMARY: 1 errors from 1 contexts (suppressed: 0 from 0)
[33;1m
------------ MÁS PRUEBAS DEL TDA ABB ------------
==================================================[37;1m
[33;1m
PRUEBAS DE CREACIÓN Y DESTRUCCIÓN
===================================[37;1m
[33;1m
Destrucción de abbs NULL
=========================[37;1m
==13585== Invalid read of size 8
==13585==    at 0x109978: abb_destruir_todo (abb.c:34)
==13585==    by 0x109978: abb_destruir (abb.c:26)
==13585==    by 0x11180E: pruebas_creacion_y_destruccion (pruebas_abb.c:105)
==13585==    by 0x1240A8: pruebas_abril (pruebas_abb.c:1639)
==13585==    by 0x10969F: main (pruebas_chanutron.c:707)
==13585==  Address 0x8 is not stack'd, malloc'd or (recently) free'd
==13585== 
[32;1m✓ [37;1mSe está por probar si es posible destruir un abb nulo.
[31;1m

FINALIZACION ANORMAL DE LAS PRUEBAS

[37;1m==13585== 
==13585== HEAP SUMMARY:
==13585==     in use at exit: 0 bytes in 0 blocks
==13585==   total heap usage: 1 allocs, 1 frees, 4,096 bytes allocated
==13585== 
==13585== All heap blocks were freed -- no leaks are possible
==13585== 
==13585== For lists of detected and suppressed errors, rerun with: -s
==13585== ERROR SUMMARY: 1 errors from 1 contexts (suppressed: 0 from 0)
[33;1m
Creación de abbs con comparador válido e inválido
====================================================[37;1m
[32;1m✓ [37;1mSe crea el abb.
[32;1m✓ [37;1mEl abb se crea vacío.
[32;1m✓ [37;1mEl tamaño de un abb recién creado es 0.
[32;1m✓ [37;1mSe está por probar si es posible destruir un abb vacío.
[32;1m✓ [37;1mSe crea otro abb.
[32;1m✓ [37;1mSe está por probar si es posible destruir este abb vacío con un destructor nulo.
[32;1m✓ [37;1mNo es posible crear un abb con un comparador nulo.
==13586== 
==13586== HEAP SUMMARY:
==13586==     in use at exit: 0 bytes in 0 blocks
==13586==   total heap usage: 3 allocs, 3 frees, 4,144 bytes allocated
==13586== 
==13586== All heap blocks were freed -- no leaks are possible
==13586== 
==13586== For lists of detected and suppressed errors, rerun with: -s
==13586== ERROR SUMMARY: 0 errors from 0 contexts (suppressed: 0 from 0)
==13584== 
==13584== HEAP SUMMARY:
==13584==     in use at exit: 0 bytes in 0 blocks
==13584==   total heap usage: 1 allocs, 1 frees, 4,096 bytes allocated
==13584== 
==13584== All heap blocks were freed -- no leaks are possible
==13584== 
==13584== For lists of detected and suppressed errors, rerun with: -s
==13584== ERROR SUMMARY: 0 errors from 0 contexts (suppressed: 0 from 0)
[33;1m
PRUEBAS DE INSERCIÓN
=====================[37;1m
[33;1m
Inserción en abb nulo
======================[37;1m
[32;1m✓ [37;1mAl intentar insertar en un abb nulo, se devuelve false
==13588== 
==13588== HEAP SUMMARY:
==13588==     in use at exit: 0 bytes in 0 blocks
==13588==   total heap usage: 1 allocs, 1 frees, 4,096 bytes allocated
==13588== 
==13588== All heap blocks were freed -- no leaks are possible
==13588== 
==13588== For lists of detected and suppressed errors, rerun with: -s
==13588== ERROR SUMMARY: 0 errors from 0 contexts (suppressed: 0 from 0)
[33;1m
Inserciones en abb válido
==========================[37;1m
[32;1m✓ [37;1mEs posible insertar un elemento nulo en un abb válido
[32;1m✓ [37;1mEl abb no está vacío
[32;1m✓ [37;1mEl abb posee un elemento
[32;1m✓ [37;1mEs posible insertar un elemento no nulo en un abb válido
[32;1m✓ [37;1mEl abb no está vacío
[32;1m✓ [37;1mEl abb posee un elemento (1 == 1).
[32;1m✓ [37;1mEs posible insertar un elemento que vive en el heap en un abb válido
[32;1m✓ [37;1mEl abb no está vacío
[32;1m✓ [37;1mEl abb posee un elemento
[32;1m✓ [37;1mEs posible insertar un elemento en un abb válido
[32;1m✓ [37;1mEs posible insertar otro elemento
[32;1m✓ [37;1mEs posible insertar otro elemento
[32;1m✓ [37;1mEl abb no está vacío
[32;1m✓ [37;1mEl abb posee tres elemento
[32;1m✓ [37;1mSe crea un nuevo arbol y se insertan 500 elementos (500 == 500).
[32;1m✓ [37;1mEl abb no está vacío
[32;1m✓ [37;1mEs posible insertar un elemento en un abb válido
[32;1m✓ [37;1mEs posible insertar otro elemento 
[32;1m✓ [37;1mEs posible insertar un elemento repetido en el abb
[32;1m✓ [37;1mEl abb no está vacío
[32;1m✓ [37;1mEl abb posee tres elemento
==13589== 
==13589== HEAP SUMMARY:
==13589==     in use at exit: 0 bytes in 0 blocks
==13589==   total heap usage: 517 allocs, 517 frees, 16,460 bytes allocated
==13589== 
==13589== All heap blocks were freed -- no leaks are possible
==13589== 
==13589== For lists of detected and suppressed errors, rerun with: -s
==13589== ERROR SUMMARY: 0 errors from 0 contexts (suppressed: 0 from 0)
==13587== 
==13587== HEAP SUMMARY:
==13587==     in use at exit: 0 bytes in 0 blocks
==13587==   total heap usage: 1 allocs, 1 frees, 4,096 bytes allocated
==13587== 
==13587== All heap blocks were freed -- no leaks are possible
==13587== 
==13587== For lists of detected and suppressed errors, rerun with: -s
==13587== ERROR SUMMARY: 0 errors from 0 contexts (suppressed: 0 from 0)
[33;1m
PRUEBAS DE BÚSQUEDA
====================[37;1m
[33;1m
Búsqueda en abb nulo
=====================[37;1m
[32;1m✓ [37;1mBuscar un elemento válido en un abb nulo devuelve NULL.
==13591== 
==13591== HEAP SUMMARY:
==13591==     in use at exit: 0 bytes in 0 blocks
==13591==   total heap usage: 1 allocs, 1 frees, 4,096 bytes allocated
==13591== 
==13591== All heap blocks were freed -- no leaks are possible
==13591== 
==13591== For lists of detected and suppressed errors, rerun with: -s
==13591== ERROR SUMMARY: 0 errors from 0 contexts (suppressed: 0 from 0)
[33;1m
Búsqueda de elementos existentes e inexistentes en abb válido
===============================================================[37;1m
==13592== Invalid read of size 8
==13592==    at 0x10A3D0: interna_obtener_nodo (abb_internas.c:124)
==13592==    by 0x109DB4: abb_obtener (abb.c:164)
==13592==    by 0x112FDE: buscar_un_elemento_inexistente_en_el_abb_genera_error (pruebas_abb.c:262)
==13592==    by 0x113968: pruebas_busqueda (pruebas_abb.c:320)
==13592==    by 0x12409F: pruebas_abril (pruebas_abb.c:1644)
==13592==    by 0x10969F: main (pruebas_chanutron.c:707)
==13592==  Address 0x0 is not stack'd, malloc'd or (recently) free'd
==13592== 
[32;1m✓ [37;1mSe encontró el elemento buscado.
[31;1m

ERROR MIENTRAS SE EJECUTABA LA PRUEBA: [33;1m'Se buscó un elemento inexistente en un abb y se devolvió NULL.'

[37;1m==13592== 
==13592== HEAP SUMMARY:
==13592==     in use at exit: 24 bytes in 1 blocks
==13592==   total heap usage: 4 allocs, 3 frees, 4,168 bytes allocated
==13592== 
==13592== 24 bytes in 1 blocks are still reachable in loss record 1 of 1
==13592==    at 0x484D953: calloc (in /usr/libexec/valgrind/vgpreload_memcheck-amd64-linux.so)
==13592==    by 0x10993B: abb_crear (abb.c:12)
==13592==    by 0x112F64: buscar_un_elemento_inexistente_en_el_abb_genera_error (pruebas_abb.c:259)
==13592==    by 0x113968: pruebas_busqueda (pruebas_abb.c:320)
==13592==    by 0x12409F: pruebas_abril (pruebas_abb.c:1644)
==13592==    by 0x10969F: main (pruebas_chanutron.c:707)
==13592== 
==13592== LEAK SUMMARY:
==13592==    definitely lost: 0 bytes in 0 blocks
==13592==    indirectly lost: 0 bytes in 0 blocks
==13592==      possibly lost: 0 bytes in 0 blocks
==13592==    still reachable: 24 bytes in 1 blocks
==13592==         suppressed: 0 bytes in 0 blocks
==13592== 
==13592== For lists of detected and suppressed errors, rerun with: -s
==13592== ERROR SUMMARY: 1 errors from 1 contexts (suppressed: 0 from 0)
[33;1m
Pruebas mixtas de búsqueda
===========================[37;1m
==13593== Invalid write of size 8
==13593==    at 0x109C6F: abb_quitar (abb.c:136)
==13593==    by 0x11341C: pruebas_mixtas_con_buscar (pruebas_abb.c:300)
==13593==    by 0x113958: pruebas_busqueda (pruebas_abb.c:327)
==13593==    by 0x12409F: pruebas_abril (pruebas_abb.c:1644)
==13593==    by 0x10969F: main (pruebas_chanutron.c:707)
==13593==  Address 0x0 is not stack'd, malloc'd or (recently) free'd
==13593== 
[32;1m✓ [37;1mSe creó un abb y se insertó un elemento. Se encuentra ese elemento.
[32;1m✓ [37;1mSe insertan múltiples elementos, algunos repetidos.
[32;1m✓ [37;1mSe busca un elemento que no se encuentra en el abb y se devuelve NULL.
[32;1m✓ [37;1mSe busca uno de los elementos repetidos en el abb y se lo encuentra.
[31;1m

FINALIZACION ANORMAL DE LAS PRUEBAS

[37;1m==13593== 
==13593== HEAP SUMMARY:
==13593==     in use at exit: 120 bytes in 5 blocks
==13593==   total heap usage: 6 allocs, 1 frees, 4,216 bytes allocated
==13593== 
==13593== 24 bytes in 1 blocks are still reachable in loss record 1 of 5
==13593==    at 0x484D953: calloc (in /usr/libexec/valgrind/vgpreload_memcheck-amd64-linux.so)
==13593==    by 0x10993B: abb_crear (abb.c:12)
==13593==    by 0x1130A2: pruebas_mixtas_con_buscar (pruebas_abb.c:271)
==13593==    by 0x113958: pruebas_busqueda (pruebas_abb.c:327)
==13593==    by 0x12409F: pruebas_abril (pruebas_abb.c:1644)
==13593==    by 0x10969F: main (pruebas_chanutron.c:707)
==13593== 
==13593== 24 bytes in 1 blocks are still reachable in loss record 2 of 5
==13593==    at 0x484D953: calloc (in /usr/libexec/valgrind/vgpreload_memcheck-amd64-linux.so)
==13593==    by 0x10A13B: crear_nodo (abb_internas.c:6)
==13593==    by 0x10A13B: interna_insertar (abb_internas.c:19)
==13593==    by 0x1099DC: abb_insertar (abb.c:47)
==13593==    by 0x1130D8: pruebas_mixtas_con_buscar (pruebas_abb.c:279)
==13593==    by 0x113958: pruebas_busqueda (pruebas_abb.c:327)
==13593==    by 0x12409F: pruebas_abril (pruebas_abb.c:1644)
==13593==    by 0x10969F: main (pruebas_chanutron.c:707)
==13593== 
==13593== 24 bytes in 1 blocks are still reachable in loss record 3 of 5
==13593==    at 0x484D953: calloc (in /usr/libexec/valgrind/vgpreload_memcheck-amd64-linux.so)
==13593==    by 0x10A13B: crear_nodo (abb_internas.c:6)
==13593==    by 0x10A13B: interna_insertar (abb_internas.c:19)
==13593==    by 0x1099DC: abb_insertar (abb.c:47)
==13593==    by 0x1131CC: pruebas_mixtas_con_buscar (pruebas_abb.c:285)
==13593==    by 0x113958: pruebas_busqueda (pruebas_abb.c:327)
==13593==    by 0x12409F: pruebas_abril (pruebas_abb.c:1644)
==13593==    by 0x10969F: main (pruebas_chanutron.c:707)
==13593== 
==13593== 24 bytes in 1 blocks are still reachable in loss record 4 of 5
==13593==    at 0x484D953: calloc (in /usr/libexec/valgrind/vgpreload_memcheck-amd64-linux.so)
==13593==    by 0x10A13B: crear_nodo (abb_internas.c:6)
==13593==    by 0x10A13B: interna_insertar (abb_internas.c:19)
==13593==    by 0x1099DC: abb_insertar (abb.c:47)
==13593==    by 0x1131D7: pruebas_mixtas_con_buscar (pruebas_abb.c:286)
==13593==    by 0x113958: pruebas_busqueda (pruebas_abb.c:327)
==13593==    by 0x12409F: pruebas_abril (pruebas_abb.c:1644)
==13593==    by 0x10969F: main (pruebas_chanutron.c:707)
==13593== 
==13593== 24 bytes in 1 blocks are still reachable in loss record 5 of 5
==13593==    at 0x484D953: calloc (in /usr/libexec/valgrind/vgpreload_memcheck-amd64-linux.so)
==13593==    by 0x10A13B: crear_nodo (abb_internas.c:6)
==13593==    by 0x10A13B: interna_insertar (abb_internas.c:19)
==13593==    by 0x1099DC: abb_insertar (abb.c:47)
==13593==    by 0x1131EC: pruebas_mixtas_con_buscar (pruebas_abb.c:287)
==13593==    by 0x113958: pruebas_busqueda (pruebas_abb.c:327)
==13593==    by 0x12409F: pruebas_abril (pruebas_abb.c:1644)
==13593==    by 0x10969F: main (pruebas_chanutron.c:707)
==13593== 
==13593== LEAK SUMMARY:
==13593==    definitely lost: 0 bytes in 0 blocks
==13593==    indirectly lost: 0 bytes in 0 blocks
==13593==      possibly lost: 0 bytes in 0 blocks
==13593==    still reachable: 120 bytes in 5 blocks
==13593==         suppressed: 0 bytes in 0 blocks
==13593== 
==13593== For lists of detected and suppressed errors, rerun with: -s
==13593== ERROR SUMMARY: 1 errors from 1 contexts (suppressed: 0 from 0)
==13590== 
==13590== HEAP SUMMARY:
==13590==     in use at exit: 0 bytes in 0 blocks
==13590==   total heap usage: 1 allocs, 1 frees, 4,096 bytes allocated
==13590== 
==13590== All heap blocks were freed -- no leaks are possible
==13590== 
==13590== For lists of detected and suppressed errors, rerun with: -s
==13590== ERROR SUMMARY: 0 errors from 0 contexts (suppressed: 0 from 0)
[33;1m
PRUEBAS DE ELIMINACIÓN
=======================[37;1m
[33;1m
Eliminación en abb nulo
========================[37;1m
[32;1m✓ [37;1mNo se puede eliminar de un abb nulo
==13595== 
==13595== HEAP SUMMARY:
==13595==     in use at exit: 0 bytes in 0 blocks
==13595==   total heap usage: 1 allocs, 1 frees, 4,096 bytes allocated
==13595== 
==13595== All heap blocks were freed -- no leaks are possible
==13595== 
==13595== For lists of detected and suppressed errors, rerun with: -s
==13595== ERROR SUMMARY: 0 errors from 0 contexts (suppressed: 0 from 0)
[33;1m
Eliminación de elementos existentes e inexistentes en abb válido
==================================================================[37;1m
[32;1m✓ [37;1mSe tiene un abb no vacío
[32;1m✓ [37;1mEs posible eliminar el unico elemento que tiene el abb
[32;1m✓ [37;1mEl elemento devuelto es el esperado (0x1fff00047c == 0x1fff00047c).
[32;1m✓ [37;1mEl abb ahora está vacío
[32;1m✓ [37;1mSe tiene un abb no vacío
[32;1m✓ [37;1mEs posible eliminar el unico elemento que tiene el abb
[32;1m✓ [37;1mEl elemento devuelto es el esperado ((nil) == (nil)).
[32;1m✓ [37;1mEl abb ahora está vacío
[32;1m✓ [37;1mSe tiene un abb vacío
[32;1m✓ [37;1mIntentar eliminar un elemento de un abb vacío devuelve false
[32;1m✓ [37;1mEl abb continúa vacío
[32;1m✓ [37;1mSe inserta un elemento en el abb. Ahora ya no está vacío
[32;1m✓ [37;1mIntentar eliminar un elemento que no se encuentra en el abb devuelve false
[32;1m✓ [37;1mEl abb no borró el elemento que almacenaba
==13596== 
==13596== HEAP SUMMARY:
==13596==     in use at exit: 0 bytes in 0 blocks
==13596==   total heap usage: 7 allocs, 7 frees, 4,240 bytes allocated
==13596== 
==13596== All heap blocks were freed -- no leaks are possible
==13596== 
==13596== For lists of detected and suppressed errors, rerun with: -s
==13596== ERROR SUMMARY: 0 errors from 0 contexts (suppressed: 0 from 0)
[33;1m
Eliminación de varios elementos de abbs grandes
================================================[37;1m
[32;1m✓ [37;1mTengo un nuevo abb. Su tamaño es 16
[32;1m✓ [37;1mEs posible quitar la raiz
[32;1m✓ [37;1mEl elemento devuelto es el esperado (0x1fff000430 == 0x1fff000430).
[32;1m✓ [37;1mBusco el elemento que acabo de borrar del abb y no lo encuentro
[32;1m✓ [37;1mEl tamaño del abb ahora es 15 (15).
[32;1m✓ [37;1mEs posible quitar un elemento que solo tiene hijo izquierdo, sin nietos
[32;1m✓ [37;1mEl elemento devuelto es el esperado (0x1fff00043c == 0x1fff00043c).
[32;1m✓ [37;1mBusco el elemento que acabo de borrar del abb y no lo encuentro
[32;1m✓ [37;1mEl tamaño del abb ahora es 14
[32;1m✓ [37;1mEs posible quitar un elemento que tiene dos hijos y varios nietos
[32;1m✓ [37;1mEl elemento devuelto es el esperado (0x1fff000434 == 0x1fff000434).
[32;1m✓ [37;1mBusco el elemento que acabo de borrar del abb y no lo encuentro
[32;1m✓ [37;1mEl tamaño del abb ahora es 13
[32;1m✓ [37;1mEs posible quitar un elemento que solo tiene hijo izquierdo, con nietos
[32;1m✓ [37;1mEl elemento devuelto es el esperado (0x1fff00046c == 0x1fff00046c).
[32;1m✓ [37;1mBusco el elemento que acabo de borrar del abb y no lo encuentro
[32;1m✓ [37;1mEl tamaño del abb ahora es 12
[32;1m✓ [37;1mEs posible quitar un elemento que solo tiene hijo dercho, con nietos
[32;1m✓ [37;1mEl elemento devuelto es el esperado (0x1fff000440 == 0x1fff000440).
[32;1m✓ [37;1mBusco el elemento que acabo de borrar del abb y no lo encuentro
[32;1m✓ [37;1mEl tamaño del abb ahora es 11
[32;1m✓ [37;1mEs posible quitar un elemento que tiene hijo izquierdo y derecho, sin nietos
[32;1m✓ [37;1mEl elemento devuelto es el esperado (0x1fff000438 == 0x1fff000438).
[32;1m✓ [37;1mBusco el elemento que acabo de borrar del abb y no lo encuentro
[32;1m✓ [37;1mEl tamaño del abb ahora es 10
[32;1m✓ [37;1mEs posible quitar un elemento que solo tiene hijo derecho, sin nietos
[32;1m✓ [37;1mEl elemento devuelto es el esperado (0x1fff000450 == 0x1fff000450).
[32;1m✓ [37;1mBusco el elemento que acabo de borrar del abb y no lo encuentro
[32;1m✓ [37;1mEl tamaño del abb ahora es 9
[32;1m✓ [37;1mEs posible quitar la nueva raiz, que tiene hijos derecho e izquierdo
[32;1m✓ [37;1mEl elemento devuelto es el esperado (0x1fff000460 == 0x1fff000460).
[32;1m✓ [37;1mBusco el elemento que acabo de borrar del abb y no lo encuentro
[32;1m✓ [37;1mEl tamaño del abb ahora es 8
[32;1m✓ [37;1mEs posible quitar un elemento que tiene hijo izquierdo y derecho, con nietos
[32;1m✓ [37;1mEl elemento devuelto es el esperado (0x1fff00045c == 0x1fff00045c).
[32;1m✓ [37;1mBusco el elemento que acabo de borrar del abb y no lo encuentro
[32;1m✓ [37;1mEl tamaño del abb ahora es 7
[32;1m✓ [37;1mEs posible quitar la nueva raiz, que no tiene hijo izquierdo, así que la reemplaza su hijo derecho
[32;1m✓ [37;1mEl elemento devuelto es el esperado (0x1fff000448 == 0x1fff000448).
[32;1m✓ [37;1mBusco el elemento que acabo de borrar del abb y no lo encuentro
[32;1m✓ [37;1mEl tamaño del abb ahora es 6
[32;1m✓ [37;1mEs posible quitar un elemento que no tiene hijos
[32;1m✓ [37;1mEl elemento devuelto es el esperado (0x1fff000468 == 0x1fff000468).
[32;1m✓ [37;1mBusco el elemento que acabo de borrar del abb y no lo encuentro
[32;1m✓ [37;1mEl tamaño del abb ahora es 5
==13597== 
==13597== HEAP SUMMARY:
==13597==     in use at exit: 0 bytes in 0 blocks
==13597==   total heap usage: 18 allocs, 18 frees, 4,504 bytes allocated
==13597== 
==13597== All heap blocks were freed -- no leaks are possible
==13597== 
==13597== For lists of detected and suppressed errors, rerun with: -s
==13597== ERROR SUMMARY: 0 errors from 0 contexts (suppressed: 0 from 0)
==13594== 
==13594== HEAP SUMMARY:
==13594==     in use at exit: 0 bytes in 0 blocks
==13594==   total heap usage: 1 allocs, 1 frees, 4,096 bytes allocated
==13594== 
==13594== All heap blocks were freed -- no leaks are possible
==13594== 
==13594== For lists of detected and suppressed errors, rerun with: -s
==13594== ERROR SUMMARY: 0 errors from 0 contexts (suppressed: 0 from 0)
[33;1m
PRUEBAS DEL ITERADOR
====================[37;1m
[33;1m
Iterar un abb nulo
==================[37;1m
==13599== Invalid read of size 8
==13599==    at 0x109E18: abb_iterar_inorden (abb.c:192)
==13599==    by 0x116E9A: iterar_un_abb_nulo (pruebas_abb.c:667)
==13599==    by 0x1181FE: pruebas_iterador (pruebas_abb.c:796)
==13599==    by 0x1240B1: pruebas_abril (pruebas_abb.c:1648)
==13599==    by 0x10969F: main (pruebas_chanutron.c:707)
==13599==  Address 0x8 is not stack'd, malloc'd or (recently) free'd
==13599== 
[31;1m

ERROR MIENTRAS SE EJECUTABA LA PRUEBA: [33;1m'Iterar un abb NULL de manera INORDEN devuelve 0'

[37;1m==13599== 
==13599== HEAP SUMMARY:
==13599==     in use at exit: 0 bytes in 0 blocks
==13599==   total heap usage: 1 allocs, 1 frees, 4,096 bytes allocated
==13599== 
==13599== All heap blocks were freed -- no leaks are possible
==13599== 
==13599== For lists of detected and suppressed errors, rerun with: -s
==13599== ERROR SUMMARY: 1 errors from 1 contexts (suppressed: 0 from 0)
[33;1m
Iterar con una función nula
============================[37;1m
==13600== Invalid read of size 8
==13600==    at 0x10A197: interna_inorden_recursivo (abb_internas.c:44)
==13600==    by 0x109E49: abb_iterar_inorden (abb.c:195)
==13600==    by 0x117182: iterar_con_funcion_null (pruebas_abb.c:686)
==13600==    by 0x11823F: pruebas_iterador (pruebas_abb.c:798)
==13600==    by 0x1240B1: pruebas_abril (pruebas_abb.c:1648)
==13600==    by 0x10969F: main (pruebas_chanutron.c:707)
==13600==  Address 0x8 is not stack'd, malloc'd or (recently) free'd
==13600== 
[31;1m

ERROR MIENTRAS SE EJECUTABA LA PRUEBA: [33;1m'Iterar de manera INORDEN un abb válido con una función NULL devuelve 0'

[37;1m==13600== 
==13600== HEAP SUMMARY:
==13600==     in use at exit: 24 bytes in 1 blocks
==13600==   total heap usage: 2 allocs, 1 frees, 4,120 bytes allocated
==13600== 
==13600== 24 bytes in 1 blocks are still reachable in loss record 1 of 1
==13600==    at 0x484D953: calloc (in /usr/libexec/valgrind/vgpreload_memcheck-amd64-linux.so)
==13600==    by 0x10993B: abb_crear (abb.c:12)
==13600==    by 0x117101: iterar_con_funcion_null (pruebas_abb.c:684)
==13600==    by 0x11823F: pruebas_iterador (pruebas_abb.c:798)
==13600==    by 0x1240B1: pruebas_abril (pruebas_abb.c:1648)
==13600==    by 0x10969F: main (pruebas_chanutron.c:707)
==13600== 
==13600== LEAK SUMMARY:
==13600==    definitely lost: 0 bytes in 0 blocks
==13600==    indirectly lost: 0 bytes in 0 blocks
==13600==      possibly lost: 0 bytes in 0 blocks
==13600==    still reachable: 24 bytes in 1 blocks
==13600==         suppressed: 0 bytes in 0 blocks
==13600== 
==13600== For lists of detected and suppressed errors, rerun with: -s
==13600== ERROR SUMMARY: 1 errors from 1 contexts (suppressed: 0 from 0)
[33;1m
Iterar un abb válido
=====================[37;1m
==13601== Invalid read of size 8
==13601==    at 0x10A197: interna_inorden_recursivo (abb_internas.c:44)
==13601==    by 0x109E49: abb_iterar_inorden (abb.c:195)
==13601==    by 0x117508: iterar_un_abb_vacio (pruebas_abb.c:708)
==13601==    by 0x118228: pruebas_iterador (pruebas_abb.c:801)
==13601==    by 0x1240B1: pruebas_abril (pruebas_abb.c:1648)
==13601==    by 0x10969F: main (pruebas_chanutron.c:707)
==13601==  Address 0x8 is not stack'd, malloc'd or (recently) free'd
==13601== 
[32;1m✓ [37;1mSe crea un abb.
[31;1m

ERROR MIENTRAS SE EJECUTABA LA PRUEBA: [33;1m'Se itera el abb de manera INORDEN en su totalidad con un aux nulo y se devuelve 0 correctamente'

[37;1m==13601== 
==13601== HEAP SUMMARY:
==13601==     in use at exit: 24 bytes in 1 blocks
==13601==   total heap usage: 2 allocs, 1 frees, 4,120 bytes allocated
==13601== 
==13601== 24 bytes in 1 blocks are still reachable in loss record 1 of 1
==13601==    at 0x484D953: calloc (in /usr/libexec/valgrind/vgpreload_memcheck-amd64-linux.so)
==13601==    by 0x10993B: abb_crear (abb.c:12)
==13601==    by 0x117407: iterar_un_abb_vacio (pruebas_abb.c:704)
==13601==    by 0x118228: pruebas_iterador (pruebas_abb.c:801)
==13601==    by 0x1240B1: pruebas_abril (pruebas_abb.c:1648)
==13601==    by 0x10969F: main (pruebas_chanutron.c:707)
==13601== 
==13601== LEAK SUMMARY:
==13601==    definitely lost: 0 bytes in 0 blocks
==13601==    indirectly lost: 0 bytes in 0 blocks
==13601==      possibly lost: 0 bytes in 0 blocks
==13601==    still reachable: 24 bytes in 1 blocks
==13601==         suppressed: 0 bytes in 0 blocks
==13601== 
==13601== For lists of detected and suppressed errors, rerun with: -s
==13601== ERROR SUMMARY: 1 errors from 1 contexts (suppressed: 0 from 0)
==13598== 
==13598== HEAP SUMMARY:
==13598==     in use at exit: 0 bytes in 0 blocks
==13598==   total heap usage: 1 allocs, 1 frees, 4,096 bytes allocated
==13598== 
==13598== All heap blocks were freed -- no leaks are possible
==13598== 
==13598== For lists of detected and suppressed errors, rerun with: -s
==13598== ERROR SUMMARY: 0 errors from 0 contexts (suppressed: 0 from 0)
[33;1m
PRUEBAS DE RECORRIDOS CON ARRAY
===============================[37;1m
[33;1m
Recorrer un abb nulo
====================[37;1m
==13603== Invalid read of size 8
==13603==    at 0x109EE8: abb_iterar_inorden (abb.c:192)
==13603==    by 0x109EE8: abb_vectorizar_inorden (abb.c:239)
==13603==    by 0x1182DF: recorrer_abb_nulo (pruebas_abb.c:814)
==13603==    by 0x123B4F: pruebas_recorridos_array (pruebas_abb.c:1617)
==13603==    by 0x12405E: pruebas_abril (pruebas_abb.c:1650)
==13603==    by 0x10969F: main (pruebas_chanutron.c:707)
==13603==  Address 0x8 is not stack'd, malloc'd or (recently) free'd
==13603== 
[31;1m

ERROR MIENTRAS SE EJECUTABA LA PRUEBA: [33;1m'Si se intenta recorrer de manera INORDEN un abb NULL, se devuelve el valor 0'

[37;1m==13603== 
==13603== HEAP SUMMARY:
==13603==     in use at exit: 32 bytes in 1 blocks
==13603==   total heap usage: 2 allocs, 1 frees, 4,128 bytes allocated
==13603== 
==13603== 32 bytes in 1 blocks are still reachable in loss record 1 of 1
==13603==    at 0x4846828: malloc (in /usr/libexec/valgrind/vgpreload_memcheck-amd64-linux.so)
==13603==    by 0x118261: crear_array (pruebas_abb.c:46)
==13603==    by 0x118261: recorrer_abb_nulo (pruebas_abb.c:812)
==13603==    by 0x123B4F: pruebas_recorridos_array (pruebas_abb.c:1617)
==13603==    by 0x12405E: pruebas_abril (pruebas_abb.c:1650)
==13603==    by 0x10969F: main (pruebas_chanutron.c:707)
==13603== 
==13603== LEAK SUMMARY:
==13603==    definitely lost: 0 bytes in 0 blocks
==13603==    indirectly lost: 0 bytes in 0 blocks
==13603==      possibly lost: 0 bytes in 0 blocks
==13603==    still reachable: 32 bytes in 1 blocks
==13603==         suppressed: 0 bytes in 0 blocks
==13603== 
==13603== For lists of detected and suppressed errors, rerun with: -s
==13603== ERROR SUMMARY: 1 errors from 1 contexts (suppressed: 0 from 0)
[33;1m
Recorrer con un array nulo y con tamanio cero
=============================================[37;1m
==13604== Invalid read of size 8
==13604==    at 0x10A197: interna_inorden_recursivo (abb_internas.c:44)
==13604==    by 0x109F39: abb_iterar_inorden (abb.c:195)
==13604==    by 0x109F39: abb_vectorizar_inorden (abb.c:239)
==13604==    by 0x1185CD: recorrer_con_array_nulo (pruebas_abb.c:834)
==13604==    by 0x123B6F: pruebas_recorridos_array (pruebas_abb.c:1619)
==13604==    by 0x12405E: pruebas_abril (pruebas_abb.c:1650)
==13604==    by 0x10969F: main (pruebas_chanutron.c:707)
==13604==  Address 0x8 is not stack'd, malloc'd or (recently) free'd
==13604== 
[31;1m

ERROR MIENTRAS SE EJECUTABA LA PRUEBA: [33;1m'Si se intenta recorrer de manera INORDEN un abb válido con un array nulo, se devuelve 0'

[37;1m==13604== 
==13604== HEAP SUMMARY:
==13604==     in use at exit: 24 bytes in 1 blocks
==13604==   total heap usage: 2 allocs, 1 frees, 4,120 bytes allocated
==13604== 
==13604== 24 bytes in 1 blocks are still reachable in loss record 1 of 1
==13604==    at 0x484D953: calloc (in /usr/libexec/valgrind/vgpreload_memcheck-amd64-linux.so)
==13604==    by 0x10993B: abb_crear (abb.c:12)
==13604==    by 0x118543: recorrer_con_array_nulo (pruebas_abb.c:832)
==13604==    by 0x123B6F: pruebas_recorridos_array (pruebas_abb.c:1619)
==13604==    by 0x12405E: pruebas_abril (pruebas_abb.c:1650)
==13604==    by 0x10969F: main (pruebas_chanutron.c:707)
==13604== 
==13604== LEAK SUMMARY:
==13604==    definitely lost: 0 bytes in 0 blocks
==13604==    indirectly lost: 0 bytes in 0 blocks
==13604==      possibly lost: 0 bytes in 0 blocks
==13604==    still reachable: 24 bytes in 1 blocks
==13604==         suppressed: 0 bytes in 0 blocks
==13604== 
==13604== For lists of detected and suppressed errors, rerun with: -s
==13604== ERROR SUMMARY: 1 errors from 1 contexts (suppressed: 0 from 0)
[33;1m
Recorrer un abb válido
=======================[37;1m
==13605== Invalid read of size 8
==13605==    at 0x10A197: interna_inorden_recursivo (abb_internas.c:44)
==13605==    by 0x109F39: abb_iterar_inorden (abb.c:195)
==13605==    by 0x109F39: abb_vectorizar_inorden (abb.c:239)
==13605==    by 0x1188D7: recorrer_un_abb_vacio (pruebas_abb.c:852)
==13605==    by 0x123B58: pruebas_recorridos_array (pruebas_abb.c:1622)
==13605==    by 0x12405E: pruebas_abril (pruebas_abb.c:1650)
==13605==    by 0x10969F: main (pruebas_chanutron.c:707)
==13605==  Address 0x8 is not stack'd, malloc'd or (recently) free'd
==13605== 
[31;1m

ERROR MIENTRAS SE EJECUTABA LA PRUEBA: [33;1m'Si se intenta recorrer de manera INORDEN un abb vacío, se devuelve 0'

[37;1m==13605== 
==13605== HEAP SUMMARY:
==13605==     in use at exit: 56 bytes in 2 blocks
==13605==   total heap usage: 3 allocs, 1 frees, 4,152 bytes allocated
==13605== 
==13605== 24 bytes in 1 blocks are still reachable in loss record 1 of 2
==13605==    at 0x484D953: calloc (in /usr/libexec/valgrind/vgpreload_memcheck-amd64-linux.so)
==13605==    by 0x10993B: abb_crear (abb.c:12)
==13605==    by 0x118856: recorrer_un_abb_vacio (pruebas_abb.c:850)
==13605==    by 0x123B58: pruebas_recorridos_array (pruebas_abb.c:1622)
==13605==    by 0x12405E: pruebas_abril (pruebas_abb.c:1650)
==13605==    by 0x10969F: main (pruebas_chanutron.c:707)
==13605== 
==13605== 32 bytes in 1 blocks are still reachable in loss record 2 of 2
==13605==    at 0x4846828: malloc (in /usr/libexec/valgrind/vgpreload_memcheck-amd64-linux.so)
==13605==    by 0x118847: crear_array (pruebas_abb.c:46)
==13605==    by 0x118847: recorrer_un_abb_vacio (pruebas_abb.c:849)
==13605==    by 0x123B58: pruebas_recorridos_array (pruebas_abb.c:1622)
==13605==    by 0x12405E: pruebas_abril (pruebas_abb.c:1650)
==13605==    by 0x10969F: main (pruebas_chanutron.c:707)
==13605== 
==13605== LEAK SUMMARY:
==13605==    definitely lost: 0 bytes in 0 blocks
==13605==    indirectly lost: 0 bytes in 0 blocks
==13605==      possibly lost: 0 bytes in 0 blocks
==13605==    still reachable: 56 bytes in 2 blocks
==13605==         suppressed: 0 bytes in 0 blocks
==13605== 
==13605== For lists of detected and suppressed errors, rerun with: -s
==13605== ERROR SUMMARY: 1 errors from 1 contexts (suppressed: 0 from 0)
[33;1m
Recorrer un abb válido, modificarlo y volver a recorrerlo
==========================================================[37;1m
[32;1m✓ [37;1mEs posible insertar en un nuevo abb
[32;1m✓ [37;1mEl abb posee 1 elemento
[32;1m✓ [37;1mEl abb no está vacío
[32;1m✓ [37;1mSe recorre el abb y se almacena la cantidad correcta de elementos
[32;1m✓ [37;1mEl elemento almacenado es el correcto
[32;1m✓ [37;1mSe insertaron varios elementos. Ahora el abb posee 6 elementos
[32;1m✓ [37;1mEl abb no está vacío
[32;1m✓ [37;1mSe vuelve a recorrer el abb y se almacena la nueva cantidad correcta de elementos
[32;1m✓ [37;1mEl primer elemento es el correcto
[32;1m✓ [37;1mEl segundo elemento es el correcto
[32;1m✓ [37;1mEl tercer elemento es el correcto
[32;1m✓ [37;1mEl cuarto elemento es el correcto
[32;1m✓ [37;1mEl quinto elemento es el correcto
[32;1m✓ [37;1mEl sexto elemento es el correcto
[32;1m✓ [37;1mSe inserta un nuevo elemento en el abb, más chico que el menor anterior
[32;1m✓ [37;1mSe inserta un elemento repetido en el abb
[32;1m✓ [37;1mSe inserta un nuevo elemento máximo en el abb, mayor al más grande anterior
[32;1m✓ [37;1mSe insertaron varios elementos. Ahora el abb posee 9 elementos
[32;1m✓ [37;1mEl abb no está vacío
[32;1m✓ [37;1mSe vuelve a recorrer el abb y se almacena la nueva cantidad correcta de elementos
[32;1m✓ [37;1mEl primer elemento es el correcto
[32;1m✓ [37;1mEl segundo elemento es el correcto
[32;1m✓ [37;1mEl tercer elemento es el correcto
[32;1m✓ [37;1mEl cuarto elemento es el correcto
[32;1m✓ [37;1mEl quinto elemento es el correcto
[32;1m✓ [37;1mEl sexto elemento es el correcto
[32;1m✓ [37;1mEl séptimo elemento es el correcto
[32;1m✓ [37;1mEl octavo elemento es el correcto
[32;1m✓ [37;1mEl noveno elemento es el correcto
[32;1m✓ [37;1mTengo un nuevo abb. Su tamaño es 16
[32;1m✓ [37;1mSe recorre el abb y se almacena la cantidad correcta de elementos
[32;1m✓ [37;1mEl 1º elemento almacenado es el correcto
[32;1m✓ [37;1mEl 2º elemento almacenado es el correcto
[32;1m✓ [37;1mEl 3º elemento almacenado es el correcto
[32;1m✓ [37;1mEl 4º elemento almacenado es el correcto
[32;1m✓ [37;1mEl 5º elemento almacenado es el correcto
[32;1m✓ [37;1mEl 6º elemento almacenado es el correcto
[32;1m✓ [37;1mEl 7º elemento almacenado es el correcto
[32;1m✓ [37;1mEl 8º elemento almacenado es el correcto
[32;1m✓ [37;1mEl 9º elemento almacenado es el correcto
[32;1m✓ [37;1mEl 10º elemento almacenado es el correcto
[32;1m✓ [37;1mEl 11º elemento almacenado es el correcto
[32;1m✓ [37;1mEl 12º elemento almacenado es el correcto
[32;1m✓ [37;1mEl 13º elemento almacenado es el correcto
[32;1m✓ [37;1mEl 14º elemento almacenado es el correcto
[32;1m✓ [37;1mEl 15º elemento almacenado es el correcto
[32;1m✓ [37;1mEl 16º elemento almacenado es el correcto
[32;1m✓ [37;1mEs posible quitar la raiz
[32;1m✓ [37;1mEl elemento devuelto es el esperado (0x1fff000444 == 0x1fff000444).
[32;1m✓ [37;1mSe recorre el abb y se almacena la cantidad correcta de elementos
[32;1m✓ [37;1mEl 1º elemento almacenado es el correcto
[32;1m✓ [37;1mEl 2º elemento almacenado es el correcto
[32;1m✓ [37;1mEl 3º elemento almacenado es el correcto
[32;1m✓ [37;1mEl 4º elemento almacenado es el correcto
[32;1m✓ [37;1mEl 5º elemento almacenado es el correcto
[32;1m✓ [37;1mEl 6º elemento almacenado es el correcto
[32;1m✓ [37;1mEl 7º elemento almacenado es el correcto
[32;1m✓ [37;1mEl 8º elemento almacenado es el correcto
[32;1m✓ [37;1mEl 9º elemento almacenado es el correcto
[32;1m✓ [37;1mEl 10º elemento almacenado es el correcto
[32;1m✓ [37;1mEl 11º elemento almacenado es el correcto
[32;1m✓ [37;1mEl 12º elemento almacenado es el correcto
[32;1m✓ [37;1mEl 13º elemento almacenado es el correcto
[32;1m✓ [37;1mEl 14º elemento almacenado es el correcto
[32;1m✓ [37;1mEl 15º elemento almacenado es el correcto
[32;1m✓ [37;1mEs posible quitar un elemento que solo tiene hijo izquierdo, sin nietos
[32;1m✓ [37;1mEl elemento devuelto es el esperado (0x1fff000434 == 0x1fff000434).
[32;1m✓ [37;1mSe recorre el abb y se almacena la cantidad correcta de elementos
[32;1m✓ [37;1mEl 1º elemento almacenado es el correcto
[32;1m✓ [37;1mEl 2º elemento almacenado es el correcto
[32;1m✓ [37;1mEl 3º elemento almacenado es el correcto
[32;1m✓ [37;1mEl 4º elemento almacenado es el correcto
[32;1m✓ [37;1mEl 5º elemento almacenado es el correcto
[32;1m✓ [37;1mEl 6º elemento almacenado es el correcto
[32;1m✓ [37;1mEl 7º elemento almacenado es el correcto
[32;1m✓ [37;1mEl 8º elemento almacenado es el correcto
[32;1m✓ [37;1mEl 9º elemento almacenado es el correcto
[32;1m✓ [37;1mEl 10º elemento almacenado es el correcto
[32;1m✓ [37;1mEl 11º elemento almacenado es el correcto
[32;1m✓ [37;1mEl 12º elemento almacenado es el correcto
[32;1m✓ [37;1mEl 13º elemento almacenado es el correcto
[32;1m✓ [37;1mEl 14º elemento almacenado es el correcto
[32;1m✓ [37;1mEs posible quitar un elemento que tiene dos hijos y varios nietos
[32;1m✓ [37;1mEl elemento devuelto es el esperado (0x1fff00045c == 0x1fff00045c).
[32;1m✓ [37;1mSe recorre el abb y se almacena la cantidad correcta de elementos
[32;1m✓ [37;1mEl 1º elemento almacenado es el correcto
[32;1m✓ [37;1mEl 2º elemento almacenado es el correcto
[32;1m✓ [37;1mEl 3º elemento almacenado es el correcto
[32;1m✓ [37;1mEl 4º elemento almacenado es el correcto
[32;1m✓ [37;1mEl 5º elemento almacenado es el correcto
[32;1m✓ [37;1mEl 6º elemento almacenado es el correcto
[32;1m✓ [37;1mEl 7º elemento almacenado es el correcto
[32;1m✓ [37;1mEl 8º elemento almacenado es el correcto
[32;1m✓ [37;1mEl 9º elemento almacenado es el correcto
[32;1m✓ [37;1mEl 10º elemento almacenado es el correcto
[32;1m✓ [37;1mEl 11º elemento almacenado es el correcto
[32;1m✓ [37;1mEl 12º elemento almacenado es el correcto
[32;1m✓ [37;1mEl 13º elemento almacenado es el correcto
[32;1m✓ [37;1mEs posible quitar un elemento que solo tiene hijo izquierdo, con nietos
[32;1m✓ [37;1mEl elemento devuelto es el esperado (0x1fff000454 == 0x1fff000454).
[32;1m✓ [37;1mSe recorre el abb y se almacena la cantidad correcta de elementos
[32;1m✓ [37;1mEl 1º elemento almacenado es el correcto
[32;1m✓ [37;1mEl 2º elemento almacenado es el correcto
[32;1m✓ [37;1mEl 3º elemento almacenado es el correcto
[32;1m✓ [37;1mEl 4º elemento almacenado es el correcto
[32;1m✓ [37;1mEl 5º elemento almacenado es el correcto
[32;1m✓ [37;1mEl 6º elemento almacenado es el correcto
[32;1m✓ [37;1mEl 7º elemento almacenado es el correcto
[32;1m✓ [37;1mEl 8º elemento almacenado es el correcto
[32;1m✓ [37;1mEl 9º elemento almacenado es el correcto
[32;1m✓ [37;1mEl 10º elemento almacenado es el correcto
[32;1m✓ [37;1mEl 11º elemento almacenado es el correcto
[32;1m✓ [37;1mEl 12º elemento almacenado es el correcto
[32;1m✓ [37;1mEs posible quitar un elemento que solo tiene hijo dercho, con nietos
[32;1m✓ [37;1mEl elemento devuelto es el esperado (0x1fff000460 == 0x1fff000460).
[32;1m✓ [37;1mSe recorre el abb y se almacena la cantidad correcta de elementos
[32;1m✓ [37;1mEl 1º elemento almacenado es el correcto
[32;1m✓ [37;1mEl 2º elemento almacenado es el correcto
[32;1m✓ [37;1mEl 3º elemento almacenado es el correcto
[32;1m✓ [37;1mEl 4º elemento almacenado es el correcto
[32;1m✓ [37;1mEl 5º elemento almacenado es el correcto
[32;1m✓ [37;1mEl 6º elemento almacenado es el correcto
[32;1m✓ [37;1mEl 7º elemento almacenado es el correcto
[32;1m✓ [37;1mEl 8º elemento almacenado es el correcto
[32;1m✓ [37;1mEl 9º elemento almacenado es el correcto
[32;1m✓ [37;1mEl 10º elemento almacenado es el correcto
[32;1m✓ [37;1mEl 11º elemento almacenado es el correcto
[32;1m✓ [37;1mEs posible quitar un elemento que tiene hijo izquierdo y derecho, sin nietos
[32;1m✓ [37;1mEl elemento devuelto es el esperado (0x1fff000438 == 0x1fff000438).
[32;1m✓ [37;1mSe recorre el abb y se almacena la cantidad correcta de elementos
[32;1m✓ [37;1mEl 1º elemento almacenado es el correcto
[32;1m✓ [37;1mEl 2º elemento almacenado es el correcto
[32;1m✓ [37;1mEl 3º elemento almacenado es el correcto
[32;1m✓ [37;1mEl 4º elemento almacenado es el correcto
[32;1m✓ [37;1mEl 5º elemento almacenado es el correcto
[32;1m✓ [37;1mEl 6º elemento almacenado es el correcto
[32;1m✓ [37;1mEl 7º elemento almacenado es el correcto
[32;1m✓ [37;1mEl 8º elemento almacenado es el correcto
[32;1m✓ [37;1mEl 9º elemento almacenado es el correcto
[32;1m✓ [37;1mEl 10º elemento almacenado es el correcto
[32;1m✓ [37;1mEs posible quitar un elemento que solo tiene hijo derecho, sin nietos
[32;1m✓ [37;1mEl elemento devuelto es el esperado (0x1fff000430 == 0x1fff000430).
[32;1m✓ [37;1mSe recorre el abb y se almacena la cantidad correcta de elementos
[32;1m✓ [37;1mEl 1º elemento almacenado es el correcto
[32;1m✓ [37;1mEl 2º elemento almacenado es el correcto
[32;1m✓ [37;1mEl 3º elemento almacenado es el correcto
[32;1m✓ [37;1mEl 4º elemento almacenado es el correcto
[32;1m✓ [37;1mEl 5º elemento almacenado es el correcto
[32;1m✓ [37;1mEl 6º elemento almacenado es el correcto
[32;1m✓ [37;1mEl 7º elemento almacenado es el correcto
[32;1m✓ [37;1mEl 8º elemento almacenado es el correcto
[32;1m✓ [37;1mEl 9º elemento almacenado es el correcto
[32;1m✓ [37;1mEs posible quitar la nueva raiz, que tiene hijos derecho e izquierdo
[32;1m✓ [37;1mEl elemento devuelto es el esperado (0x1fff000440 == 0x1fff000440).
[32;1m✓ [37;1mSe recorre el abb y se almacena la cantidad correcta de elementos
[32;1m✓ [37;1mEl 1º elemento almacenado es el correcto
[32;1m✓ [37;1mEl 2º elemento almacenado es el correcto
[32;1m✓ [37;1mEl 3º elemento almacenado es el correcto
[32;1m✓ [37;1mEl 4º elemento almacenado es el correcto
[32;1m✓ [37;1mEl 5º elemento almacenado es el correcto
[32;1m✓ [37;1mEl 6º elemento almacenado es el correcto
[32;1m✓ [37;1mEl 7º elemento almacenado es el correcto
[32;1m✓ [37;1mEl 8º elemento almacenado es el correcto
[32;1m✓ [37;1mEs posible quitar un elemento que tiene hijo izquierdo y derecho, con nietos
[32;1m✓ [37;1mEl elemento devuelto es el esperado (0x1fff000458 == 0x1fff000458).
[32;1m✓ [37;1mSe recorre el abb y se almacena la cantidad correcta de elementos
[32;1m✓ [37;1mEl 1º elemento almacenado es el correcto
[32;1m✓ [37;1mEl 2º elemento almacenado es el correcto
[32;1m✓ [37;1mEl 3º elemento almacenado es el correcto
[32;1m✓ [37;1mEl 4º elemento almacenado es el correcto
[32;1m✓ [37;1mEl 5º elemento almacenado es el correcto
[32;1m✓ [37;1mEl 6º elemento almacenado es el correcto
[32;1m✓ [37;1mEl 7º elemento almacenado es el correcto
[32;1m✓ [37;1mEs posible quitar la nueva raiz, que no tiene hijo izquierdo, así que la reemplaza su hijo derecho
[32;1m✓ [37;1mEl elemento devuelto es el esperado (0x1fff00043c == 0x1fff00043c).
[32;1m✓ [37;1mSe recorre el abb y se almacena la cantidad correcta de elementos
[32;1m✓ [37;1mEl 1º elemento almacenado es el correcto
[32;1m✓ [37;1mEl 2º elemento almacenado es el correcto
[32;1m✓ [37;1mEl 3º elemento almacenado es el correcto
[32;1m✓ [37;1mEl 4º elemento almacenado es el correcto
[32;1m✓ [37;1mEl 5º elemento almacenado es el correcto
[32;1m✓ [37;1mEl 6º elemento almacenado es el correcto
[32;1m✓ [37;1mEs posible quitar un elemento que no tiene hijos
[32;1m✓ [37;1mEl elemento devuelto es el esperado (0x1fff000448 == 0x1fff000448).
[32;1m✓ [37;1mSe recorre el abb y se almacena la cantidad correcta de elementos
[32;1m✓ [37;1mEl 1º elemento almacenado es el correcto
[32;1m✓ [37;1mEl 2º elemento almacenado es el correcto
[32;1m✓ [37;1mEl 3º elemento almacenado es el correcto
[32;1m✓ [37;1mEl 4º elemento almacenado es el correcto
[32;1m✓ [37;1mEl 5º elemento almacenado es el correcto
==13606== 
==13606== HEAP SUMMARY:
==13606==     in use at exit: 0 bytes in 0 blocks
==13606==   total heap usage: 30 allocs, 30 frees, 5,136 bytes allocated
==13606== 
==13606== All heap blocks were freed -- no leaks are possible
==13606== 
==13606== For lists of detected and suppressed errors, rerun with: -s
==13606== ERROR SUMMARY: 0 errors from 0 contexts (suppressed: 0 from 0)
==13602== 
==13602== HEAP SUMMARY:
==13602==     in use at exit: 0 bytes in 0 blocks
==13602==   total heap usage: 1 allocs, 1 frees, 4,096 bytes allocated
==13602== 
==13602== All heap blocks were freed -- no leaks are possible
==13602== 
==13602== For lists of detected and suppressed errors, rerun with: -s
==13602== ERROR SUMMARY: 0 errors from 0 contexts (suppressed: 0 from 0)
[37;1m
---------------------------------
435 pruebas corridas, 11 errores - D:
[0m==13574== 
==13574== HEAP SUMMARY:
==13574==     in use at exit: 0 bytes in 0 blocks
==13574==   total heap usage: 1 allocs, 1 frees, 4,096 bytes allocated
==13574== 
==13574== All heap blocks were freed -- no leaks are possible
==13574== 
==13574== For lists of detected and suppressed errors, rerun with: -s
==13574== ERROR SUMMARY: 0 errors from 0 contexts (suppressed: 0 from 0)
make: *** [makefile-chanutron:8: valgrind] Error 2

[1;31m¡ERROR CORRIENDO VALGRIND! Revisa tu entrega, las pruebas de la CÁTEDRA no pasan.[0m

