Archivos Entregados
===================

[ 173]  .
|-- [4.6K]  Enunciado.md
|-- [1.8K]  README.md
|-- [  25]  ejemplos
|   `-- [ 164]  pokedex.csv
|-- [ 171]  img
|   |-- [ 32K]  algo2.svg
|   |-- [ 19K]  diagrama1.svg
|   |-- [9.9K]  diagrama2.svg
|   |-- [ 10K]  pruebas_esperado.jpg
|   |-- [ 11K]  pruebas_esperado_mas_3_elem.jpg
|   `-- [ 11K]  pruebas_esperado_sin_5_elem.jpg
|-- [ 740]  makefile
|-- [1.3K]  pa2m.h
|-- [ 51K]  pruebas_alumno
|-- [7.4K]  pruebas_alumno.c
|-- [ 134]  src
|   |-- [6.6K]  abb.c
|   |-- [1.8K]  abb.h
|   |-- [ 388]  abb_estructura_privada.h
|   |-- [3.7K]  abb_internas.c
|   |-- [ 745]  abb_internas.h
|   |-- [1.7K]  csv.c
|   `-- [1.2K]  csv.h
`-- [4.8K]  tp_abb.c

4 directories, 21 files

[1;35mLinter
======
[0m
[1;32mLINTER OK[0m

[1;35mCompilación y pruebas
========================[0m
rm -f *.o pruebas_chanutron pruebas_alumno tp-abb
gcc -std=c99 -Wall -Wconversion -Wtype-limits -pedantic  -O2 -g src/*.c pruebas_chanutron.c pruebas_aux.c -o pruebas_chanutron
rm -f pruebas_chanutron.c pruebas_aux.c pruebas_abb.c
valgrind --leak-check=full --track-origins=yes --show-reachable=yes --error-exitcode=2 --show-leak-kinds=all --trace-children=yes ./pruebas_chanutron
==8129== Memcheck, a memory error detector
==8129== Copyright (C) 2002-2022, and GNU GPL'd, by Julian Seward et al.
==8129== Using Valgrind-3.22.0 and LibVEX; rerun with -h for copyright info
==8129== Command: ./pruebas_chanutron
==8129== 
[33;1m
Pruebas de creación de ABB
===========================[37;1m
[32;1m✓ [37;1mSe puede crear un abb
[32;1m✓ [37;1mEl abb se crea vacío
[32;1m✓ [37;1mLa cantidad de elementos es cero
[32;1m✓ [37;1mEl elemento raíz es NULL
==8130== 
==8130== HEAP SUMMARY:
==8130==     in use at exit: 0 bytes in 0 blocks
==8130==   total heap usage: 2 allocs, 2 frees, 4,120 bytes allocated
==8130== 
==8130== All heap blocks were freed -- no leaks are possible
==8130== 
==8130== For lists of detected and suppressed errors, rerun with: -s
==8130== ERROR SUMMARY: 0 errors from 0 contexts (suppressed: 0 from 0)
[33;1m
Pruebas de inserción
=====================[37;1m
[32;1m✓ [37;1mPuedo insertar un elemento en el abb.
[32;1m✓ [37;1mEl elemento queda como valor raíz
[32;1m✓ [37;1mEl abb ya no está vacío.
[32;1m✓ [37;1mLa cantidad de elementos es 1
[32;1m✓ [37;1mPuedo insertar un elemento menor que el primero.
[32;1m✓ [37;1mEl abb queda con un hijo izquierdo y sin hijo derecho.
[32;1m✓ [37;1mEl elemento queda a la izquierda de la raíz.
[32;1m✓ [37;1mLa cantidad de elementos es 2
[32;1m✓ [37;1mPuedo insertar un elemento mayor que el primero.
[32;1m✓ [37;1mEl abb queda con un hijo izquierdo y un hijo derecho.
[32;1m✓ [37;1mEl elemento queda a la derecha de la raíz.
[32;1m✓ [37;1mLa cantidad de elementos es 3
[32;1m✓ [37;1mLos tres elementos se encuentran en las posiciones esperadas.
[32;1m✓ [37;1mPuedo insertar un elemento menor a los que estaban.
[32;1m✓ [37;1mEl hijo izquierdo del raíz ahora tiene un hijo izquierdo.
[32;1m✓ [37;1mEl elemento tiene el valor esperado.
[32;1m✓ [37;1mLa cantidad de elementos es 4
[32;1m✓ [37;1mPuedo insertar un elemento mayor a los que estaban.
[32;1m✓ [37;1mEl hijo derecho del raíz ahora tiene un hijo derecho.
[32;1m✓ [37;1mEl elemento tiene el valor esperado.
[32;1m✓ [37;1mLa cantidad de elementos es 5
==8131== 
==8131== HEAP SUMMARY:
==8131==     in use at exit: 0 bytes in 0 blocks
==8131==   total heap usage: 7 allocs, 7 frees, 4,240 bytes allocated
==8131== 
==8131== All heap blocks were freed -- no leaks are possible
==8131== 
==8131== For lists of detected and suppressed errors, rerun with: -s
==8131== ERROR SUMMARY: 0 errors from 0 contexts (suppressed: 0 from 0)
[33;1m
Pruebas de búsqueda
====================[37;1m
==8132== Invalid read of size 8
==8132==    at 0x109DB5: abb_obtener (abb.c:165)
==8132==    by 0x10C690: probar_busqueda_abb (pruebas_chanutron.c:214)
==8132==    by 0x1097E2: main (pruebas_chanutron.c:689)
==8132==  Address 0x0 is not stack'd, malloc'd or (recently) free'd
==8132== 
[32;1m✓ [37;1mBusco un elemento existente y lo encuentro
[32;1m✓ [37;1mBusco un elemento existente y lo encuentro
[32;1m✓ [37;1mBusco un elemento existente y lo encuentro
[32;1m✓ [37;1mBusco un elemento existente y lo encuentro
[32;1m✓ [37;1mBusco un elemento existente y lo encuentro
[32;1m✓ [37;1mBusco un elemento existente y lo encuentro
[32;1m✓ [37;1mBusco un elemento existente y lo encuentro
[32;1m✓ [37;1mBusco un elemento existente y lo encuentro
[32;1m✓ [37;1mBusco un elemento existente y lo encuentro
[32;1m✓ [37;1mBusco un elemento existente y lo encuentro
[31;1m

ERROR MIENTRAS SE EJECUTABA LA PRUEBA: [33;1m'Buscar un elemento inexistente devuelve NULL.'

[37;1m==8132== 
==8132== HEAP SUMMARY:
==8132==     in use at exit: 264 bytes in 11 blocks
==8132==   total heap usage: 12 allocs, 1 frees, 4,360 bytes allocated
==8132== 
==8132== 24 bytes in 1 blocks are still reachable in loss record 1 of 2
==8132==    at 0x484D953: calloc (in /usr/libexec/valgrind/vgpreload_memcheck-amd64-linux.so)
==8132==    by 0x10993B: abb_crear (abb.c:12)
==8132==    by 0x10C477: probar_busqueda_abb (pruebas_chanutron.c:191)
==8132==    by 0x1097E2: main (pruebas_chanutron.c:689)
==8132== 
==8132== 240 bytes in 10 blocks are still reachable in loss record 2 of 2
==8132==    at 0x484D953: calloc (in /usr/libexec/valgrind/vgpreload_memcheck-amd64-linux.so)
==8132==    by 0x10A11B: crear_nodo (abb_internas.c:6)
==8132==    by 0x10A11B: interna_insertar (abb_internas.c:17)
==8132==    by 0x1099DC: abb_insertar (abb.c:47)
==8132==    by 0x10C4CE: probar_busqueda_abb (pruebas_chanutron.c:197)
==8132==    by 0x1097E2: main (pruebas_chanutron.c:689)
==8132== 
==8132== LEAK SUMMARY:
==8132==    definitely lost: 0 bytes in 0 blocks
==8132==    indirectly lost: 0 bytes in 0 blocks
==8132==      possibly lost: 0 bytes in 0 blocks
==8132==    still reachable: 264 bytes in 11 blocks
==8132==         suppressed: 0 bytes in 0 blocks
==8132== 
==8132== For lists of detected and suppressed errors, rerun with: -s
==8132== ERROR SUMMARY: 1 errors from 1 contexts (suppressed: 0 from 0)
[33;1m
Pruebas de borrado
==================[37;1m
[32;1m✓ [37;1mPuedo borrar un nodo hoja
[32;1m✓ [37;1mEl elemento devuelto es el esperado (0x1fff0004d8 == 0x1fff0004d8).
[32;1m✓ [37;1mEl nodo eliminado no existe mas.
[32;1m✓ [37;1mLa cantidad de elementos es 6
[32;1m✓ [37;1mPuedo borrar un nodo no hoja con un hijo.
[32;1m✓ [37;1mEl elemento devuelto es el esperado (0x1fff0004c8 == 0x1fff0004c8).
[32;1m✓ [37;1mEl nodo que queda en su lugar es el nodo hijo.
[32;1m✓ [37;1mLa cantidad de elementos es 5
[32;1m✓ [37;1mPuedo borrar un nodo con dos hijos.
[32;1m✓ [37;1mEl elemento devuelto es el esperado (0x1fff0004d0 == 0x1fff0004d0).
[31;1m✗ [37;1mEl nodo que queda en su lugar es el predecesor inorden ¯\_(ツ)_/¯ .
[32;1m✓ [37;1mPuedo borrar el nodo raíz (con dos hijos).
[32;1m✓ [37;1mEl elemento devuelto es el esperado (0x1fff0004c0 == 0x1fff0004c0).
[31;1m✗ [37;1mEl nodo que queda en su lugar es el predecesor inorden ¯\_(ツ)_/¯ .
[32;1m✓ [37;1mLa cantidad de elementos es 3
[31;1m✗ [37;1mA la izquierda de la raíz queda el elemento esperado.
[31;1m✗ [37;1mA la derecha de la raíz queda el elemento esperado.
[32;1m✓ [37;1mPuedo borrar el nodo raíz (con un hijo).
[32;1m✓ [37;1mEl elemento devuelto es el esperado (0x1fff0004e8 == 0x1fff0004e8).
[32;1m✓ [37;1mEl nodo que queda en su lugar es el unico hijo.
[32;1m✓ [37;1mA la izquierda de la raíz queda el elemento esperado.
[32;1m✓ [37;1mA la derecha de la raíz queda el elemento esperado.
[32;1m✓ [37;1mPuedo borrar otro nodo hoja.
[32;1m✓ [37;1mEl elemento devuelto es el esperado (0x1fff0004e0 == 0x1fff0004e0).
[32;1m✓ [37;1mA la izquierda de la raíz queda el elemento esperado.
[32;1m✓ [37;1mA la derecha de la raíz queda el elemento esperado.
[32;1m✓ [37;1mPuedo borrar el nodo raíz (sin hijos).
[32;1m✓ [37;1mEl elemento devuelto es el esperado (0x1fff0004f0 == 0x1fff0004f0).
[32;1m✓ [37;1mLa cantidad de elementos es 0
[32;1m✓ [37;1mNo queda nadie en la raíz, abb vacío.
[32;1m✓ [37;1mLa funcion abb_vacio devuelve true.
==8133== 
==8133== HEAP SUMMARY:
==8133==     in use at exit: 0 bytes in 0 blocks
==8133==   total heap usage: 9 allocs, 9 frees, 4,288 bytes allocated
==8133== 
==8133== All heap blocks were freed -- no leaks are possible
==8133== 
==8133== For lists of detected and suppressed errors, rerun with: -s
==8133== ERROR SUMMARY: 0 errors from 0 contexts (suppressed: 0 from 0)
[33;1m
Pruebas de borrado (siempre borra la raíz)
===========================================[37;1m
[32;1m✓ [37;1mPuedo borrar la raíz del abb.
[32;1m✓ [37;1mEl elemento devuelto es el esperado (0x1fff0004a0 == 0x1fff0004a0).
[31;1m✗ [37;1mEl elemento que queda en la raíz es el predecesor inorden ¯\_(ツ)_/¯ .
[32;1m✓ [37;1mPuedo borrar la raíz del abb.
[32;1m✓ [37;1mEl elemento devuelto es el esperado (0x1fff0004e8 == 0x1fff0004e8).
[31;1m✗ [37;1mEl elemento que queda en la raíz es el predecesor inorden ¯\_(ツ)_/¯ .
[32;1m✓ [37;1mPuedo borrar la raíz del abb.
[32;1m✓ [37;1mEl elemento devuelto es el esperado (0x1fff0004e0 == 0x1fff0004e0).
[31;1m✗ [37;1mEl elemento que queda en la raíz es el predecesor inorden ¯\_(ツ)_/¯ .
[32;1m✓ [37;1mLa cantidad de elementos es 7 (7 == 7).
[32;1m✓ [37;1mPude eliminar todos los elementos restantes del abb siempre borrando la raíz.
[32;1m✓ [37;1mEl abb queda vacío.
==8134== 
==8134== HEAP SUMMARY:
==8134==     in use at exit: 0 bytes in 0 blocks
==8134==   total heap usage: 12 allocs, 12 frees, 4,360 bytes allocated
==8134== 
==8134== All heap blocks were freed -- no leaks are possible
==8134== 
==8134== For lists of detected and suppressed errors, rerun with: -s
==8134== ERROR SUMMARY: 0 errors from 0 contexts (suppressed: 0 from 0)
[33;1m
Pruebas de insertar/eliminar/buscar
===================================[37;1m
==8135== Invalid read of size 8
==8135==    at 0x109DB5: abb_obtener (abb.c:165)
==8135==    by 0x110957: probar_abb_variado (pruebas_chanutron.c:642)
==8135==    by 0x109786: main (pruebas_chanutron.c:697)
==8135==  Address 0x0 is not stack'd, malloc'd or (recently) free'd
==8135== 
[32;1m✓ [37;1mBorro la raiz del abb.
[32;1m✓ [37;1mEl elemento devuelto es el esperado (0x1fff0004a0 == 0x1fff0004a0).
[31;1m

ERROR MIENTRAS SE EJECUTABA LA PRUEBA: [33;1m'El elemento no existe mas en el abb.'

[37;1m==8135== 
==8135== HEAP SUMMARY:
==8135==     in use at exit: 240 bytes in 10 blocks
==8135==   total heap usage: 12 allocs, 2 frees, 4,360 bytes allocated
==8135== 
==8135== 24 bytes in 1 blocks are still reachable in loss record 1 of 2
==8135==    at 0x484D953: calloc (in /usr/libexec/valgrind/vgpreload_memcheck-amd64-linux.so)
==8135==    by 0x10993B: abb_crear (abb.c:12)
==8135==    by 0x11078B: probar_abb_variado (pruebas_chanutron.c:626)
==8135==    by 0x109786: main (pruebas_chanutron.c:697)
==8135== 
==8135== 216 bytes in 9 blocks are still reachable in loss record 2 of 2
==8135==    at 0x484D953: calloc (in /usr/libexec/valgrind/vgpreload_memcheck-amd64-linux.so)
==8135==    by 0x10A11B: crear_nodo (abb_internas.c:6)
==8135==    by 0x10A11B: interna_insertar (abb_internas.c:17)
==8135==    by 0x1099DC: abb_insertar (abb.c:47)
==8135==    by 0x1107FE: probar_abb_variado (pruebas_chanutron.c:633)
==8135==    by 0x109786: main (pruebas_chanutron.c:697)
==8135== 
==8135== LEAK SUMMARY:
==8135==    definitely lost: 0 bytes in 0 blocks
==8135==    indirectly lost: 0 bytes in 0 blocks
==8135==      possibly lost: 0 bytes in 0 blocks
==8135==    still reachable: 240 bytes in 10 blocks
==8135==         suppressed: 0 bytes in 0 blocks
==8135== 
==8135== For lists of detected and suppressed errors, rerun with: -s
==8135== ERROR SUMMARY: 1 errors from 1 contexts (suppressed: 0 from 0)
[33;1m
Pruebas de destructor
=====================[37;1m
==8136== Invalid write of size 8
==8136==    at 0x109C6F: abb_quitar (abb.c:136)
==8136==    by 0x10EA58: probar_destructor_abb (pruebas_chanutron.c:389)
==8136==    by 0x1097B0: main (pruebas_chanutron.c:700)
==8136==  Address 0x0 is not stack'd, malloc'd or (recently) free'd
==8136== 
[31;1m

FINALIZACION ANORMAL DE LAS PRUEBAS

[37;1m==8136== 
==8136== HEAP SUMMARY:
==8136==     in use at exit: 312 bytes in 13 blocks
==8136==   total heap usage: 14 allocs, 1 frees, 4,408 bytes allocated
==8136== 
==8136== 24 bytes in 1 blocks are still reachable in loss record 1 of 2
==8136==    at 0x484D953: calloc (in /usr/libexec/valgrind/vgpreload_memcheck-amd64-linux.so)
==8136==    by 0x10993B: abb_crear (abb.c:12)
==8136==    by 0x10E9E1: probar_destructor_abb (pruebas_chanutron.c:380)
==8136==    by 0x1097B0: main (pruebas_chanutron.c:700)
==8136== 
==8136== 288 bytes in 12 blocks are still reachable in loss record 2 of 2
==8136==    at 0x484D953: calloc (in /usr/libexec/valgrind/vgpreload_memcheck-amd64-linux.so)
==8136==    by 0x10A11B: crear_nodo (abb_internas.c:6)
==8136==    by 0x10A11B: interna_insertar (abb_internas.c:17)
==8136==    by 0x1099DC: abb_insertar (abb.c:47)
==8136==    by 0x10EA46: probar_destructor_abb (pruebas_chanutron.c:387)
==8136==    by 0x1097B0: main (pruebas_chanutron.c:700)
==8136== 
==8136== LEAK SUMMARY:
==8136==    definitely lost: 0 bytes in 0 blocks
==8136==    indirectly lost: 0 bytes in 0 blocks
==8136==      possibly lost: 0 bytes in 0 blocks
==8136==    still reachable: 312 bytes in 13 blocks
==8136==         suppressed: 0 bytes in 0 blocks
==8136== 
==8136== For lists of detected and suppressed errors, rerun with: -s
==8136== ERROR SUMMARY: 1 errors from 1 contexts (suppressed: 0 from 0)
[33;1m
Pruebas de recorridos e iterador interno
========================================[37;1m
[33;1m
Recorrido inorden
=================[37;1m
[31;1m✗ [37;1mLa función de recorrido devuelve la cantidad de elementos esperados
[32;1m✓ [37;1mLos elementos en el vector tienen el orden esperado.
[31;1m✗ [37;1mPido recorrer menos elementos de los existentes para hacer el recorrido.
[32;1m✓ [37;1mLos elementos en el vector tienen el orden y cantidad esperado.
[31;1m✗ [37;1mPido recorrer mas elementos de los existentes para hacer el recorrido.
[32;1m✓ [37;1mLos elementos en el vector tienen el orden y cantidad esperado.
[33;1m
Recorrido preorden
==================[37;1m
[32;1m✓ [37;1mLa función de recorrido devuelve la cantidad de elementos esperados
[32;1m✓ [37;1mLos elementos en el vector tienen el orden esperado.
[31;1m✗ [37;1mPido recorrer menos elementos de los existentes para hacer el recorrido.
[32;1m✓ [37;1mLos elementos en el vector tienen el orden y cantidad esperado.
[32;1m✓ [37;1mPido recorrer mas elementos de los existentes para hacer el recorrido.
[32;1m✓ [37;1mLos elementos en el vector tienen el orden y cantidad esperado.
[33;1m
Recorrido postorden
===================[37;1m
[32;1m✓ [37;1mLa función de recorrido devuelve la cantidad de elementos esperados
[32;1m✓ [37;1mLos elementos en el vector tienen el orden esperado.
[31;1m✗ [37;1mPido recorrer menos elementos de los existentes para hacer el recorrido.
[32;1m✓ [37;1mLos elementos en el vector tienen el orden y cantidad esperado.
[32;1m✓ [37;1mPido recorrer mas elementos de los existentes para hacer el recorrido.
[32;1m✓ [37;1mLos elementos en el vector tienen el orden y cantidad esperado.
[33;1m
Iterador interno inorden
========================[37;1m
[31;1m✗ [37;1mEl iterador interno devuelve la cantidad de elementos que se esperaba iterar.
[32;1m✓ [37;1mSe invocó la función la cantidad de veces esperada.
[32;1m✓ [37;1mSe recorrieron las claves en el orden esperado.
[31;1m✗ [37;1mCuando la función devuelve false, deja de iterar y devuelve la cantidad correcta.
[31;1m✗ [37;1mSe invocó la función de iteracion la cantidad de veces esperada.
[33;1m
Iterador interno preorden
=========================[37;1m
[32;1m✓ [37;1mEl iterador interno devuelve la cantidad de elementos que se esperaba iterar.
[32;1m✓ [37;1mSe invocó la función la cantidad de veces esperada.
[32;1m✓ [37;1mSe recorrieron las claves en el orden esperado.
[31;1m✗ [37;1mCuando la función devuelve false, deja de iterar y devuelve la cantidad correcta.
[31;1m✗ [37;1mSe invocó la función de iteracion la cantidad de veces esperada.
[33;1m
Iterador interno postorden
==========================[37;1m
[32;1m✓ [37;1mEl iterador interno devuelve la cantidad de elementos que se esperaba iterar.
[32;1m✓ [37;1mSe invocó la función la cantidad de veces esperada.
[32;1m✓ [37;1mSe recorrieron las claves en el orden esperado.
[31;1m✗ [37;1mCuando la función devuelve false, deja de iterar y devuelve la cantidad correcta.
[31;1m✗ [37;1mSe invocó la función de iteracion la cantidad de veces esperada.
==8137== 
==8137== HEAP SUMMARY:
==8137==     in use at exit: 0 bytes in 0 blocks
==8137==   total heap usage: 14 allocs, 14 frees, 4,408 bytes allocated
==8137== 
==8137== All heap blocks were freed -- no leaks are possible
==8137== 
==8137== For lists of detected and suppressed errors, rerun with: -s
==8137== ERROR SUMMARY: 0 errors from 0 contexts (suppressed: 0 from 0)
[33;1m
Pruebas con NULL
================[37;1m
==8138== Invalid read of size 8
==8138==    at 0x109E08: abb_iterar_inorden (abb.c:189)
==8138==    by 0x110195: probar_null_abb (pruebas_chanutron.c:589)
==8138==    by 0x1097C2: main (pruebas_chanutron.c:705)
==8138==  Address 0x8 is not stack'd, malloc'd or (recently) free'd
==8138== 
[32;1m✓ [37;1mNo puedo insertar nada en un abb nulo.
[32;1m✓ [37;1mNo puedo buscar nada en un abb nulo.
[32;1m✓ [37;1mNo puedo borrar nada de en un abb nulo.
[32;1m✓ [37;1mUn abb nulo es vacío.
[32;1m✓ [37;1mLa cantidad de elementos de un abb NULL es 0
[31;1m

ERROR MIENTRAS SE EJECUTABA LA PRUEBA: [33;1m'No puedo iterar un abb nulo.'

[37;1m==8138== 
==8138== HEAP SUMMARY:
==8138==     in use at exit: 0 bytes in 0 blocks
==8138==   total heap usage: 1 allocs, 1 frees, 4,096 bytes allocated
==8138== 
==8138== All heap blocks were freed -- no leaks are possible
==8138== 
==8138== For lists of detected and suppressed errors, rerun with: -s
==8138== ERROR SUMMARY: 1 errors from 1 contexts (suppressed: 0 from 0)
[33;1m
------------ MÁS PRUEBAS DEL TDA ABB ------------
==================================================[37;1m
[33;1m
PRUEBAS DE CREACIÓN Y DESTRUCCIÓN
===================================[37;1m
[33;1m
Destrucción de abbs NULL
=========================[37;1m
==8140== Invalid read of size 8
==8140==    at 0x109978: abb_destruir_todo (abb.c:34)
==8140==    by 0x109978: abb_destruir (abb.c:26)
==8140==    by 0x1117EE: pruebas_creacion_y_destruccion (pruebas_abb.c:105)
==8140==    by 0x124088: pruebas_abril (pruebas_abb.c:1639)
==8140==    by 0x10969F: main (pruebas_chanutron.c:707)
==8140==  Address 0x8 is not stack'd, malloc'd or (recently) free'd
==8140== 
[32;1m✓ [37;1mSe está por probar si es posible destruir un abb nulo.
[31;1m

FINALIZACION ANORMAL DE LAS PRUEBAS

[37;1m==8140== 
==8140== HEAP SUMMARY:
==8140==     in use at exit: 0 bytes in 0 blocks
==8140==   total heap usage: 1 allocs, 1 frees, 4,096 bytes allocated
==8140== 
==8140== All heap blocks were freed -- no leaks are possible
==8140== 
==8140== For lists of detected and suppressed errors, rerun with: -s
==8140== ERROR SUMMARY: 1 errors from 1 contexts (suppressed: 0 from 0)
[33;1m
Creación de abbs con comparador válido e inválido
====================================================[37;1m
[32;1m✓ [37;1mSe crea el abb.
[32;1m✓ [37;1mEl abb se crea vacío.
[32;1m✓ [37;1mEl tamaño de un abb recién creado es 0.
[32;1m✓ [37;1mSe está por probar si es posible destruir un abb vacío.
[32;1m✓ [37;1mSe crea otro abb.
[32;1m✓ [37;1mSe está por probar si es posible destruir este abb vacío con un destructor nulo.
[32;1m✓ [37;1mNo es posible crear un abb con un comparador nulo.
==8141== 
==8141== HEAP SUMMARY:
==8141==     in use at exit: 0 bytes in 0 blocks
==8141==   total heap usage: 3 allocs, 3 frees, 4,144 bytes allocated
==8141== 
==8141== All heap blocks were freed -- no leaks are possible
==8141== 
==8141== For lists of detected and suppressed errors, rerun with: -s
==8141== ERROR SUMMARY: 0 errors from 0 contexts (suppressed: 0 from 0)
==8139== 
==8139== HEAP SUMMARY:
==8139==     in use at exit: 0 bytes in 0 blocks
==8139==   total heap usage: 1 allocs, 1 frees, 4,096 bytes allocated
==8139== 
==8139== All heap blocks were freed -- no leaks are possible
==8139== 
==8139== For lists of detected and suppressed errors, rerun with: -s
==8139== ERROR SUMMARY: 0 errors from 0 contexts (suppressed: 0 from 0)
[33;1m
PRUEBAS DE INSERCIÓN
=====================[37;1m
[33;1m
Inserción en abb nulo
======================[37;1m
[32;1m✓ [37;1mAl intentar insertar en un abb nulo, se devuelve false
==8143== 
==8143== HEAP SUMMARY:
==8143==     in use at exit: 0 bytes in 0 blocks
==8143==   total heap usage: 1 allocs, 1 frees, 4,096 bytes allocated
==8143== 
==8143== All heap blocks were freed -- no leaks are possible
==8143== 
==8143== For lists of detected and suppressed errors, rerun with: -s
==8143== ERROR SUMMARY: 0 errors from 0 contexts (suppressed: 0 from 0)
[33;1m
Inserciones en abb válido
==========================[37;1m
[32;1m✓ [37;1mEs posible insertar un elemento nulo en un abb válido
[32;1m✓ [37;1mEl abb no está vacío
[32;1m✓ [37;1mEl abb posee un elemento
[32;1m✓ [37;1mEs posible insertar un elemento no nulo en un abb válido
[32;1m✓ [37;1mEl abb no está vacío
[32;1m✓ [37;1mEl abb posee un elemento (1 == 1).
[32;1m✓ [37;1mEs posible insertar un elemento que vive en el heap en un abb válido
[32;1m✓ [37;1mEl abb no está vacío
[32;1m✓ [37;1mEl abb posee un elemento
[32;1m✓ [37;1mEs posible insertar un elemento en un abb válido
[32;1m✓ [37;1mEs posible insertar otro elemento
[32;1m✓ [37;1mEs posible insertar otro elemento
[32;1m✓ [37;1mEl abb no está vacío
[32;1m✓ [37;1mEl abb posee tres elemento
[32;1m✓ [37;1mSe crea un nuevo arbol y se insertan 500 elementos (500 == 500).
[32;1m✓ [37;1mEl abb no está vacío
[32;1m✓ [37;1mEs posible insertar un elemento en un abb válido
[32;1m✓ [37;1mEs posible insertar otro elemento 
[32;1m✓ [37;1mEs posible insertar un elemento repetido en el abb
[32;1m✓ [37;1mEl abb no está vacío
[32;1m✓ [37;1mEl abb posee tres elemento
==8144== 
==8144== HEAP SUMMARY:
==8144==     in use at exit: 0 bytes in 0 blocks
==8144==   total heap usage: 517 allocs, 517 frees, 16,460 bytes allocated
==8144== 
==8144== All heap blocks were freed -- no leaks are possible
==8144== 
==8144== For lists of detected and suppressed errors, rerun with: -s
==8144== ERROR SUMMARY: 0 errors from 0 contexts (suppressed: 0 from 0)
==8142== 
==8142== HEAP SUMMARY:
==8142==     in use at exit: 0 bytes in 0 blocks
==8142==   total heap usage: 1 allocs, 1 frees, 4,096 bytes allocated
==8142== 
==8142== All heap blocks were freed -- no leaks are possible
==8142== 
==8142== For lists of detected and suppressed errors, rerun with: -s
==8142== ERROR SUMMARY: 0 errors from 0 contexts (suppressed: 0 from 0)
[33;1m
PRUEBAS DE BÚSQUEDA
====================[37;1m
[33;1m
Búsqueda en abb nulo
=====================[37;1m
[32;1m✓ [37;1mBuscar un elemento válido en un abb nulo devuelve NULL.
==8146== 
==8146== HEAP SUMMARY:
==8146==     in use at exit: 0 bytes in 0 blocks
==8146==   total heap usage: 1 allocs, 1 frees, 4,096 bytes allocated
==8146== 
==8146== All heap blocks were freed -- no leaks are possible
==8146== 
==8146== For lists of detected and suppressed errors, rerun with: -s
==8146== ERROR SUMMARY: 0 errors from 0 contexts (suppressed: 0 from 0)
[33;1m
Búsqueda de elementos existentes e inexistentes en abb válido
===============================================================[37;1m
==8147== Invalid read of size 8
==8147==    at 0x10A3B0: interna_obtener_nodo (abb_internas.c:113)
==8147==    by 0x109DB4: abb_obtener (abb.c:164)
==8147==    by 0x112FBE: buscar_un_elemento_inexistente_en_el_abb_genera_error (pruebas_abb.c:262)
==8147==    by 0x113948: pruebas_busqueda (pruebas_abb.c:320)
==8147==    by 0x12407F: pruebas_abril (pruebas_abb.c:1644)
==8147==    by 0x10969F: main (pruebas_chanutron.c:707)
==8147==  Address 0x0 is not stack'd, malloc'd or (recently) free'd
==8147== 
[32;1m✓ [37;1mSe encontró el elemento buscado.
[31;1m

ERROR MIENTRAS SE EJECUTABA LA PRUEBA: [33;1m'Se buscó un elemento inexistente en un abb y se devolvió NULL.'

[37;1m==8147== 
==8147== HEAP SUMMARY:
==8147==     in use at exit: 24 bytes in 1 blocks
==8147==   total heap usage: 4 allocs, 3 frees, 4,168 bytes allocated
==8147== 
==8147== 24 bytes in 1 blocks are still reachable in loss record 1 of 1
==8147==    at 0x484D953: calloc (in /usr/libexec/valgrind/vgpreload_memcheck-amd64-linux.so)
==8147==    by 0x10993B: abb_crear (abb.c:12)
==8147==    by 0x112F44: buscar_un_elemento_inexistente_en_el_abb_genera_error (pruebas_abb.c:259)
==8147==    by 0x113948: pruebas_busqueda (pruebas_abb.c:320)
==8147==    by 0x12407F: pruebas_abril (pruebas_abb.c:1644)
==8147==    by 0x10969F: main (pruebas_chanutron.c:707)
==8147== 
==8147== LEAK SUMMARY:
==8147==    definitely lost: 0 bytes in 0 blocks
==8147==    indirectly lost: 0 bytes in 0 blocks
==8147==      possibly lost: 0 bytes in 0 blocks
==8147==    still reachable: 24 bytes in 1 blocks
==8147==         suppressed: 0 bytes in 0 blocks
==8147== 
==8147== For lists of detected and suppressed errors, rerun with: -s
==8147== ERROR SUMMARY: 1 errors from 1 contexts (suppressed: 0 from 0)
[33;1m
Pruebas mixtas de búsqueda
===========================[37;1m
==8148== Invalid read of size 8
==8148==    at 0x109DB5: abb_obtener (abb.c:165)
==8148==    by 0x1132DF: pruebas_mixtas_con_buscar (pruebas_abb.c:293)
==8148==    by 0x113938: pruebas_busqueda (pruebas_abb.c:327)
==8148==    by 0x12407F: pruebas_abril (pruebas_abb.c:1644)
==8148==    by 0x10969F: main (pruebas_chanutron.c:707)
==8148==  Address 0x0 is not stack'd, malloc'd or (recently) free'd
==8148== 
[32;1m✓ [37;1mSe creó un abb y se insertó un elemento. Se encuentra ese elemento.
[32;1m✓ [37;1mSe insertan múltiples elementos, algunos repetidos.
[31;1m

ERROR MIENTRAS SE EJECUTABA LA PRUEBA: [33;1m'Se busca un elemento que no se encuentra en el abb y se devuelve NULL.'

[37;1m==8148== 
==8148== HEAP SUMMARY:
==8148==     in use at exit: 120 bytes in 5 blocks
==8148==   total heap usage: 6 allocs, 1 frees, 4,216 bytes allocated
==8148== 
==8148== 24 bytes in 1 blocks are still reachable in loss record 1 of 5
==8148==    at 0x484D953: calloc (in /usr/libexec/valgrind/vgpreload_memcheck-amd64-linux.so)
==8148==    by 0x10993B: abb_crear (abb.c:12)
==8148==    by 0x113082: pruebas_mixtas_con_buscar (pruebas_abb.c:271)
==8148==    by 0x113938: pruebas_busqueda (pruebas_abb.c:327)
==8148==    by 0x12407F: pruebas_abril (pruebas_abb.c:1644)
==8148==    by 0x10969F: main (pruebas_chanutron.c:707)
==8148== 
==8148== 24 bytes in 1 blocks are still reachable in loss record 2 of 5
==8148==    at 0x484D953: calloc (in /usr/libexec/valgrind/vgpreload_memcheck-amd64-linux.so)
==8148==    by 0x10A11B: crear_nodo (abb_internas.c:6)
==8148==    by 0x10A11B: interna_insertar (abb_internas.c:17)
==8148==    by 0x1099DC: abb_insertar (abb.c:47)
==8148==    by 0x1130B8: pruebas_mixtas_con_buscar (pruebas_abb.c:279)
==8148==    by 0x113938: pruebas_busqueda (pruebas_abb.c:327)
==8148==    by 0x12407F: pruebas_abril (pruebas_abb.c:1644)
==8148==    by 0x10969F: main (pruebas_chanutron.c:707)
==8148== 
==8148== 24 bytes in 1 blocks are still reachable in loss record 3 of 5
==8148==    at 0x484D953: calloc (in /usr/libexec/valgrind/vgpreload_memcheck-amd64-linux.so)
==8148==    by 0x10A11B: crear_nodo (abb_internas.c:6)
==8148==    by 0x10A11B: interna_insertar (abb_internas.c:17)
==8148==    by 0x1099DC: abb_insertar (abb.c:47)
==8148==    by 0x1131AC: pruebas_mixtas_con_buscar (pruebas_abb.c:285)
==8148==    by 0x113938: pruebas_busqueda (pruebas_abb.c:327)
==8148==    by 0x12407F: pruebas_abril (pruebas_abb.c:1644)
==8148==    by 0x10969F: main (pruebas_chanutron.c:707)
==8148== 
==8148== 24 bytes in 1 blocks are still reachable in loss record 4 of 5
==8148==    at 0x484D953: calloc (in /usr/libexec/valgrind/vgpreload_memcheck-amd64-linux.so)
==8148==    by 0x10A11B: crear_nodo (abb_internas.c:6)
==8148==    by 0x10A11B: interna_insertar (abb_internas.c:17)
==8148==    by 0x1099DC: abb_insertar (abb.c:47)
==8148==    by 0x1131B7: pruebas_mixtas_con_buscar (pruebas_abb.c:286)
==8148==    by 0x113938: pruebas_busqueda (pruebas_abb.c:327)
==8148==    by 0x12407F: pruebas_abril (pruebas_abb.c:1644)
==8148==    by 0x10969F: main (pruebas_chanutron.c:707)
==8148== 
==8148== 24 bytes in 1 blocks are still reachable in loss record 5 of 5
==8148==    at 0x484D953: calloc (in /usr/libexec/valgrind/vgpreload_memcheck-amd64-linux.so)
==8148==    by 0x10A11B: crear_nodo (abb_internas.c:6)
==8148==    by 0x10A11B: interna_insertar (abb_internas.c:17)
==8148==    by 0x1099DC: abb_insertar (abb.c:47)
==8148==    by 0x1131CC: pruebas_mixtas_con_buscar (pruebas_abb.c:287)
==8148==    by 0x113938: pruebas_busqueda (pruebas_abb.c:327)
==8148==    by 0x12407F: pruebas_abril (pruebas_abb.c:1644)
==8148==    by 0x10969F: main (pruebas_chanutron.c:707)
==8148== 
==8148== LEAK SUMMARY:
==8148==    definitely lost: 0 bytes in 0 blocks
==8148==    indirectly lost: 0 bytes in 0 blocks
==8148==      possibly lost: 0 bytes in 0 blocks
==8148==    still reachable: 120 bytes in 5 blocks
==8148==         suppressed: 0 bytes in 0 blocks
==8148== 
==8148== For lists of detected and suppressed errors, rerun with: -s
==8148== ERROR SUMMARY: 1 errors from 1 contexts (suppressed: 0 from 0)
==8145== 
==8145== HEAP SUMMARY:
==8145==     in use at exit: 0 bytes in 0 blocks
==8145==   total heap usage: 1 allocs, 1 frees, 4,096 bytes allocated
==8145== 
==8145== All heap blocks were freed -- no leaks are possible
==8145== 
==8145== For lists of detected and suppressed errors, rerun with: -s
==8145== ERROR SUMMARY: 0 errors from 0 contexts (suppressed: 0 from 0)
[33;1m
PRUEBAS DE ELIMINACIÓN
=======================[37;1m
[33;1m
Eliminación en abb nulo
========================[37;1m
[32;1m✓ [37;1mNo se puede eliminar de un abb nulo
==8150== 
==8150== HEAP SUMMARY:
==8150==     in use at exit: 0 bytes in 0 blocks
==8150==   total heap usage: 1 allocs, 1 frees, 4,096 bytes allocated
==8150== 
==8150== All heap blocks were freed -- no leaks are possible
==8150== 
==8150== For lists of detected and suppressed errors, rerun with: -s
==8150== ERROR SUMMARY: 0 errors from 0 contexts (suppressed: 0 from 0)
[33;1m
Eliminación de elementos existentes e inexistentes en abb válido
==================================================================[37;1m
[32;1m✓ [37;1mSe tiene un abb no vacío
[32;1m✓ [37;1mEs posible eliminar el unico elemento que tiene el abb
[32;1m✓ [37;1mEl elemento devuelto es el esperado (0x1fff00047c == 0x1fff00047c).
[32;1m✓ [37;1mEl abb ahora está vacío
[32;1m✓ [37;1mSe tiene un abb no vacío
[32;1m✓ [37;1mEs posible eliminar el unico elemento que tiene el abb
[32;1m✓ [37;1mEl elemento devuelto es el esperado ((nil) == (nil)).
[32;1m✓ [37;1mEl abb ahora está vacío
[32;1m✓ [37;1mSe tiene un abb vacío
[32;1m✓ [37;1mIntentar eliminar un elemento de un abb vacío devuelve false
[32;1m✓ [37;1mEl abb continúa vacío
[32;1m✓ [37;1mSe inserta un elemento en el abb. Ahora ya no está vacío
[32;1m✓ [37;1mIntentar eliminar un elemento que no se encuentra en el abb devuelve false
[32;1m✓ [37;1mEl abb no borró el elemento que almacenaba
==8151== 
==8151== HEAP SUMMARY:
==8151==     in use at exit: 0 bytes in 0 blocks
==8151==   total heap usage: 7 allocs, 7 frees, 4,240 bytes allocated
==8151== 
==8151== All heap blocks were freed -- no leaks are possible
==8151== 
==8151== For lists of detected and suppressed errors, rerun with: -s
==8151== ERROR SUMMARY: 0 errors from 0 contexts (suppressed: 0 from 0)
[33;1m
Eliminación de varios elementos de abbs grandes
================================================[37;1m
==8152== Invalid read of size 8
==8152==    at 0x109DB5: abb_obtener (abb.c:165)
==8152==    by 0x114A53: pruebas_con_abb_grande (pruebas_abb.c:455)
==8152==    by 0x116DC8: pruebas_eliminacion (pruebas_abb.c:658)
==8152==    by 0x124076: pruebas_abril (pruebas_abb.c:1646)
==8152==    by 0x10969F: main (pruebas_chanutron.c:707)
==8152==  Address 0x0 is not stack'd, malloc'd or (recently) free'd
==8152== 
[32;1m✓ [37;1mTengo un nuevo abb. Su tamaño es 16
[32;1m✓ [37;1mEs posible quitar la raiz
[32;1m✓ [37;1mEl elemento devuelto es el esperado (0x1fff000430 == 0x1fff000430).
[31;1m

ERROR MIENTRAS SE EJECUTABA LA PRUEBA: [33;1m'Busco el elemento que acabo de borrar del abb y no lo encuentro'

[37;1m==8152== 
==8152== HEAP SUMMARY:
==8152==     in use at exit: 384 bytes in 16 blocks
==8152==   total heap usage: 18 allocs, 2 frees, 4,504 bytes allocated
==8152== 
==8152== 24 bytes in 1 blocks are still reachable in loss record 1 of 16
==8152==    at 0x484D953: calloc (in /usr/libexec/valgrind/vgpreload_memcheck-amd64-linux.so)
==8152==    by 0x10993B: abb_crear (abb.c:12)
==8152==    by 0x114658: pruebas_con_abb_grande (pruebas_abb.c:404)
==8152==    by 0x116DC8: pruebas_eliminacion (pruebas_abb.c:658)
==8152==    by 0x124076: pruebas_abril (pruebas_abb.c:1646)
==8152==    by 0x10969F: main (pruebas_chanutron.c:707)
==8152== 
==8152== 24 bytes in 1 blocks are still reachable in loss record 2 of 16
==8152==    at 0x484D953: calloc (in /usr/libexec/valgrind/vgpreload_memcheck-amd64-linux.so)
==8152==    by 0x10A11B: crear_nodo (abb_internas.c:6)
==8152==    by 0x10A11B: interna_insertar (abb_internas.c:17)
==8152==    by 0x1099DC: abb_insertar (abb.c:47)
==8152==    by 0x114706: pruebas_con_abb_grande (pruebas_abb.c:424)
==8152==    by 0x116DC8: pruebas_eliminacion (pruebas_abb.c:658)
==8152==    by 0x124076: pruebas_abril (pruebas_abb.c:1646)
==8152==    by 0x10969F: main (pruebas_chanutron.c:707)
==8152== 
==8152== 24 bytes in 1 blocks are still reachable in loss record 3 of 16
==8152==    at 0x484D953: calloc (in /usr/libexec/valgrind/vgpreload_memcheck-amd64-linux.so)
==8152==    by 0x10A11B: crear_nodo (abb_internas.c:6)
==8152==    by 0x10A11B: interna_insertar (abb_internas.c:17)
==8152==    by 0x1099DC: abb_insertar (abb.c:47)
==8152==    by 0x11471B: pruebas_con_abb_grande (pruebas_abb.c:425)
==8152==    by 0x116DC8: pruebas_eliminacion (pruebas_abb.c:658)
==8152==    by 0x124076: pruebas_abril (pruebas_abb.c:1646)
==8152==    by 0x10969F: main (pruebas_chanutron.c:707)
==8152== 
==8152== 24 bytes in 1 blocks are still reachable in loss record 4 of 16
==8152==    at 0x484D953: calloc (in /usr/libexec/valgrind/vgpreload_memcheck-amd64-linux.so)
==8152==    by 0x10A11B: crear_nodo (abb_internas.c:6)
==8152==    by 0x10A11B: interna_insertar (abb_internas.c:17)
==8152==    by 0x1099DC: abb_insertar (abb.c:47)
==8152==    by 0x114733: pruebas_con_abb_grande (pruebas_abb.c:426)
==8152==    by 0x116DC8: pruebas_eliminacion (pruebas_abb.c:658)
==8152==    by 0x124076: pruebas_abril (pruebas_abb.c:1646)
==8152==    by 0x10969F: main (pruebas_chanutron.c:707)
==8152== 
==8152== 24 bytes in 1 blocks are still reachable in loss record 5 of 16
==8152==    at 0x484D953: calloc (in /usr/libexec/valgrind/vgpreload_memcheck-amd64-linux.so)
==8152==    by 0x10A11B: crear_nodo (abb_internas.c:6)
==8152==    by 0x10A11B: interna_insertar (abb_internas.c:17)
==8152==    by 0x1099DC: abb_insertar (abb.c:47)
==8152==    by 0x114748: pruebas_con_abb_grande (pruebas_abb.c:427)
==8152==    by 0x116DC8: pruebas_eliminacion (pruebas_abb.c:658)
==8152==    by 0x124076: pruebas_abril (pruebas_abb.c:1646)
==8152==    by 0x10969F: main (pruebas_chanutron.c:707)
==8152== 
==8152== 24 bytes in 1 blocks are still reachable in loss record 6 of 16
==8152==    at 0x484D953: calloc (in /usr/libexec/valgrind/vgpreload_memcheck-amd64-linux.so)
==8152==    by 0x10A11B: crear_nodo (abb_internas.c:6)
==8152==    by 0x10A11B: interna_insertar (abb_internas.c:17)
==8152==    by 0x1099DC: abb_insertar (abb.c:47)
==8152==    by 0x11475D: pruebas_con_abb_grande (pruebas_abb.c:428)
==8152==    by 0x116DC8: pruebas_eliminacion (pruebas_abb.c:658)
==8152==    by 0x124076: pruebas_abril (pruebas_abb.c:1646)
==8152==    by 0x10969F: main (pruebas_chanutron.c:707)
==8152== 
==8152== 24 bytes in 1 blocks are still reachable in loss record 7 of 16
==8152==    at 0x484D953: calloc (in /usr/libexec/valgrind/vgpreload_memcheck-amd64-linux.so)
==8152==    by 0x10A11B: crear_nodo (abb_internas.c:6)
==8152==    by 0x10A11B: interna_insertar (abb_internas.c:17)
==8152==    by 0x1099DC: abb_insertar (abb.c:47)
==8152==    by 0x114772: pruebas_con_abb_grande (pruebas_abb.c:429)
==8152==    by 0x116DC8: pruebas_eliminacion (pruebas_abb.c:658)
==8152==    by 0x124076: pruebas_abril (pruebas_abb.c:1646)
==8152==    by 0x10969F: main (pruebas_chanutron.c:707)
==8152== 
==8152== 24 bytes in 1 blocks are still reachable in loss record 8 of 16
==8152==    at 0x484D953: calloc (in /usr/libexec/valgrind/vgpreload_memcheck-amd64-linux.so)
==8152==    by 0x10A11B: crear_nodo (abb_internas.c:6)
==8152==    by 0x10A11B: interna_insertar (abb_internas.c:17)
==8152==    by 0x1099DC: abb_insertar (abb.c:47)
==8152==    by 0x11477F: pruebas_con_abb_grande (pruebas_abb.c:430)
==8152==    by 0x116DC8: pruebas_eliminacion (pruebas_abb.c:658)
==8152==    by 0x124076: pruebas_abril (pruebas_abb.c:1646)
==8152==    by 0x10969F: main (pruebas_chanutron.c:707)
==8152== 
==8152== 24 bytes in 1 blocks are still reachable in loss record 9 of 16
==8152==    at 0x484D953: calloc (in /usr/libexec/valgrind/vgpreload_memcheck-amd64-linux.so)
==8152==    by 0x10A11B: crear_nodo (abb_internas.c:6)
==8152==    by 0x10A11B: interna_insertar (abb_internas.c:17)
==8152==    by 0x1099DC: abb_insertar (abb.c:47)
==8152==    by 0x114797: pruebas_con_abb_grande (pruebas_abb.c:431)
==8152==    by 0x116DC8: pruebas_eliminacion (pruebas_abb.c:658)
==8152==    by 0x124076: pruebas_abril (pruebas_abb.c:1646)
==8152==    by 0x10969F: main (pruebas_chanutron.c:707)
==8152== 
==8152== 24 bytes in 1 blocks are still reachable in loss record 10 of 16
==8152==    at 0x484D953: calloc (in /usr/libexec/valgrind/vgpreload_memcheck-amd64-linux.so)
==8152==    by 0x10A11B: crear_nodo (abb_internas.c:6)
==8152==    by 0x10A11B: interna_insertar (abb_internas.c:17)
==8152==    by 0x1099DC: abb_insertar (abb.c:47)
==8152==    by 0x1147AC: pruebas_con_abb_grande (pruebas_abb.c:432)
==8152==    by 0x116DC8: pruebas_eliminacion (pruebas_abb.c:658)
==8152==    by 0x124076: pruebas_abril (pruebas_abb.c:1646)
==8152==    by 0x10969F: main (pruebas_chanutron.c:707)
==8152== 
==8152== 24 bytes in 1 blocks are still reachable in loss record 11 of 16
==8152==    at 0x484D953: calloc (in /usr/libexec/valgrind/vgpreload_memcheck-amd64-linux.so)
==8152==    by 0x10A11B: crear_nodo (abb_internas.c:6)
==8152==    by 0x10A11B: interna_insertar (abb_internas.c:17)
==8152==    by 0x1099DC: abb_insertar (abb.c:47)
==8152==    by 0x1147B9: pruebas_con_abb_grande (pruebas_abb.c:433)
==8152==    by 0x116DC8: pruebas_eliminacion (pruebas_abb.c:658)
==8152==    by 0x124076: pruebas_abril (pruebas_abb.c:1646)
==8152==    by 0x10969F: main (pruebas_chanutron.c:707)
==8152== 
==8152== 24 bytes in 1 blocks are still reachable in loss record 12 of 16
==8152==    at 0x484D953: calloc (in /usr/libexec/valgrind/vgpreload_memcheck-amd64-linux.so)
==8152==    by 0x10A11B: crear_nodo (abb_internas.c:6)
==8152==    by 0x10A11B: interna_insertar (abb_internas.c:17)
==8152==    by 0x1099DC: abb_insertar (abb.c:47)
==8152==    by 0x1147CE: pruebas_con_abb_grande (pruebas_abb.c:434)
==8152==    by 0x116DC8: pruebas_eliminacion (pruebas_abb.c:658)
==8152==    by 0x124076: pruebas_abril (pruebas_abb.c:1646)
==8152==    by 0x10969F: main (pruebas_chanutron.c:707)
==8152== 
==8152== 24 bytes in 1 blocks are still reachable in loss record 13 of 16
==8152==    at 0x484D953: calloc (in /usr/libexec/valgrind/vgpreload_memcheck-amd64-linux.so)
==8152==    by 0x10A11B: crear_nodo (abb_internas.c:6)
==8152==    by 0x10A11B: interna_insertar (abb_internas.c:17)
==8152==    by 0x1099DC: abb_insertar (abb.c:47)
==8152==    by 0x1147DB: pruebas_con_abb_grande (pruebas_abb.c:435)
==8152==    by 0x116DC8: pruebas_eliminacion (pruebas_abb.c:658)
==8152==    by 0x124076: pruebas_abril (pruebas_abb.c:1646)
==8152==    by 0x10969F: main (pruebas_chanutron.c:707)
==8152== 
==8152== 24 bytes in 1 blocks are still reachable in loss record 14 of 16
==8152==    at 0x484D953: calloc (in /usr/libexec/valgrind/vgpreload_memcheck-amd64-linux.so)
==8152==    by 0x10A11B: crear_nodo (abb_internas.c:6)
==8152==    by 0x10A11B: interna_insertar (abb_internas.c:17)
==8152==    by 0x1099DC: abb_insertar (abb.c:47)
==8152==    by 0x1147EB: pruebas_con_abb_grande (pruebas_abb.c:436)
==8152==    by 0x116DC8: pruebas_eliminacion (pruebas_abb.c:658)
==8152==    by 0x124076: pruebas_abril (pruebas_abb.c:1646)
==8152==    by 0x10969F: main (pruebas_chanutron.c:707)
==8152== 
==8152== 24 bytes in 1 blocks are still reachable in loss record 15 of 16
==8152==    at 0x484D953: calloc (in /usr/libexec/valgrind/vgpreload_memcheck-amd64-linux.so)
==8152==    by 0x10A11B: crear_nodo (abb_internas.c:6)
==8152==    by 0x10A11B: interna_insertar (abb_internas.c:17)
==8152==    by 0x1099DC: abb_insertar (abb.c:47)
==8152==    by 0x114810: pruebas_con_abb_grande (pruebas_abb.c:438)
==8152==    by 0x116DC8: pruebas_eliminacion (pruebas_abb.c:658)
==8152==    by 0x124076: pruebas_abril (pruebas_abb.c:1646)
==8152==    by 0x10969F: main (pruebas_chanutron.c:707)
==8152== 
==8152== 24 bytes in 1 blocks are definitely lost in loss record 16 of 16
==8152==    at 0x484D953: calloc (in /usr/libexec/valgrind/vgpreload_memcheck-amd64-linux.so)
==8152==    by 0x10A11B: crear_nodo (abb_internas.c:6)
==8152==    by 0x10A11B: interna_insertar (abb_internas.c:17)
==8152==    by 0x1099DC: abb_insertar (abb.c:47)
==8152==    by 0x114803: pruebas_con_abb_grande (pruebas_abb.c:437)
==8152==    by 0x116DC8: pruebas_eliminacion (pruebas_abb.c:658)
==8152==    by 0x124076: pruebas_abril (pruebas_abb.c:1646)
==8152==    by 0x10969F: main (pruebas_chanutron.c:707)
==8152== 
==8152== LEAK SUMMARY:
==8152==    definitely lost: 24 bytes in 1 blocks
==8152==    indirectly lost: 0 bytes in 0 blocks
==8152==      possibly lost: 0 bytes in 0 blocks
==8152==    still reachable: 360 bytes in 15 blocks
==8152==         suppressed: 0 bytes in 0 blocks
==8152== 
==8152== For lists of detected and suppressed errors, rerun with: -s
==8152== ERROR SUMMARY: 2 errors from 2 contexts (suppressed: 0 from 0)
==8149== 
==8149== HEAP SUMMARY:
==8149==     in use at exit: 0 bytes in 0 blocks
==8149==   total heap usage: 1 allocs, 1 frees, 4,096 bytes allocated
==8149== 
==8149== All heap blocks were freed -- no leaks are possible
==8149== 
==8149== For lists of detected and suppressed errors, rerun with: -s
==8149== ERROR SUMMARY: 0 errors from 0 contexts (suppressed: 0 from 0)
[33;1m
PRUEBAS DEL ITERADOR
====================[37;1m
[33;1m
Iterar un abb nulo
==================[37;1m
==8154== Invalid read of size 8
==8154==    at 0x109E08: abb_iterar_inorden (abb.c:189)
==8154==    by 0x116E7A: iterar_un_abb_nulo (pruebas_abb.c:667)
==8154==    by 0x1181DE: pruebas_iterador (pruebas_abb.c:796)
==8154==    by 0x124091: pruebas_abril (pruebas_abb.c:1648)
==8154==    by 0x10969F: main (pruebas_chanutron.c:707)
==8154==  Address 0x8 is not stack'd, malloc'd or (recently) free'd
==8154== 
[31;1m

ERROR MIENTRAS SE EJECUTABA LA PRUEBA: [33;1m'Iterar un abb NULL de manera INORDEN devuelve 0'

[37;1m==8154== 
==8154== HEAP SUMMARY:
==8154==     in use at exit: 0 bytes in 0 blocks
==8154==   total heap usage: 1 allocs, 1 frees, 4,096 bytes allocated
==8154== 
==8154== All heap blocks were freed -- no leaks are possible
==8154== 
==8154== For lists of detected and suppressed errors, rerun with: -s
==8154== ERROR SUMMARY: 1 errors from 1 contexts (suppressed: 0 from 0)
[33;1m
Iterar con una función nula
============================[37;1m
==8155== Invalid read of size 8
==8155==    at 0x10A17F: interna_inorden_recursivo (abb_internas.c:42)
==8155==    by 0x109E39: abb_iterar_inorden (abb.c:192)
==8155==    by 0x117162: iterar_con_funcion_null (pruebas_abb.c:686)
==8155==    by 0x11821F: pruebas_iterador (pruebas_abb.c:798)
==8155==    by 0x124091: pruebas_abril (pruebas_abb.c:1648)
==8155==    by 0x10969F: main (pruebas_chanutron.c:707)
==8155==  Address 0x8 is not stack'd, malloc'd or (recently) free'd
==8155== 
[31;1m

ERROR MIENTRAS SE EJECUTABA LA PRUEBA: [33;1m'Iterar de manera INORDEN un abb válido con una función NULL devuelve 0'

[37;1m==8155== 
==8155== HEAP SUMMARY:
==8155==     in use at exit: 24 bytes in 1 blocks
==8155==   total heap usage: 2 allocs, 1 frees, 4,120 bytes allocated
==8155== 
==8155== 24 bytes in 1 blocks are still reachable in loss record 1 of 1
==8155==    at 0x484D953: calloc (in /usr/libexec/valgrind/vgpreload_memcheck-amd64-linux.so)
==8155==    by 0x10993B: abb_crear (abb.c:12)
==8155==    by 0x1170E1: iterar_con_funcion_null (pruebas_abb.c:684)
==8155==    by 0x11821F: pruebas_iterador (pruebas_abb.c:798)
==8155==    by 0x124091: pruebas_abril (pruebas_abb.c:1648)
==8155==    by 0x10969F: main (pruebas_chanutron.c:707)
==8155== 
==8155== LEAK SUMMARY:
==8155==    definitely lost: 0 bytes in 0 blocks
==8155==    indirectly lost: 0 bytes in 0 blocks
==8155==      possibly lost: 0 bytes in 0 blocks
==8155==    still reachable: 24 bytes in 1 blocks
==8155==         suppressed: 0 bytes in 0 blocks
==8155== 
==8155== For lists of detected and suppressed errors, rerun with: -s
==8155== ERROR SUMMARY: 1 errors from 1 contexts (suppressed: 0 from 0)
[33;1m
Iterar un abb válido
=====================[37;1m
==8156== Invalid read of size 8
==8156==    at 0x10A17F: interna_inorden_recursivo (abb_internas.c:42)
==8156==    by 0x109E39: abb_iterar_inorden (abb.c:192)
==8156==    by 0x1174E8: iterar_un_abb_vacio (pruebas_abb.c:708)
==8156==    by 0x118208: pruebas_iterador (pruebas_abb.c:801)
==8156==    by 0x124091: pruebas_abril (pruebas_abb.c:1648)
==8156==    by 0x10969F: main (pruebas_chanutron.c:707)
==8156==  Address 0x8 is not stack'd, malloc'd or (recently) free'd
==8156== 
[32;1m✓ [37;1mSe crea un abb.
[31;1m

ERROR MIENTRAS SE EJECUTABA LA PRUEBA: [33;1m'Se itera el abb de manera INORDEN en su totalidad con un aux nulo y se devuelve 0 correctamente'

[37;1m==8156== 
==8156== HEAP SUMMARY:
==8156==     in use at exit: 24 bytes in 1 blocks
==8156==   total heap usage: 2 allocs, 1 frees, 4,120 bytes allocated
==8156== 
==8156== 24 bytes in 1 blocks are still reachable in loss record 1 of 1
==8156==    at 0x484D953: calloc (in /usr/libexec/valgrind/vgpreload_memcheck-amd64-linux.so)
==8156==    by 0x10993B: abb_crear (abb.c:12)
==8156==    by 0x1173E7: iterar_un_abb_vacio (pruebas_abb.c:704)
==8156==    by 0x118208: pruebas_iterador (pruebas_abb.c:801)
==8156==    by 0x124091: pruebas_abril (pruebas_abb.c:1648)
==8156==    by 0x10969F: main (pruebas_chanutron.c:707)
==8156== 
==8156== LEAK SUMMARY:
==8156==    definitely lost: 0 bytes in 0 blocks
==8156==    indirectly lost: 0 bytes in 0 blocks
==8156==      possibly lost: 0 bytes in 0 blocks
==8156==    still reachable: 24 bytes in 1 blocks
==8156==         suppressed: 0 bytes in 0 blocks
==8156== 
==8156== For lists of detected and suppressed errors, rerun with: -s
==8156== ERROR SUMMARY: 1 errors from 1 contexts (suppressed: 0 from 0)
==8153== 
==8153== HEAP SUMMARY:
==8153==     in use at exit: 0 bytes in 0 blocks
==8153==   total heap usage: 1 allocs, 1 frees, 4,096 bytes allocated
==8153== 
==8153== All heap blocks were freed -- no leaks are possible
==8153== 
==8153== For lists of detected and suppressed errors, rerun with: -s
==8153== ERROR SUMMARY: 0 errors from 0 contexts (suppressed: 0 from 0)
[33;1m
PRUEBAS DE RECORRIDOS CON ARRAY
===============================[37;1m
[33;1m
Recorrer un abb nulo
====================[37;1m
==8158== Invalid read of size 8
==8158==    at 0x109ED8: abb_iterar_inorden (abb.c:189)
==8158==    by 0x109ED8: abb_vectorizar_inorden (abb.c:236)
==8158==    by 0x1182BF: recorrer_abb_nulo (pruebas_abb.c:814)
==8158==    by 0x123B2F: pruebas_recorridos_array (pruebas_abb.c:1617)
==8158==    by 0x12403E: pruebas_abril (pruebas_abb.c:1650)
==8158==    by 0x10969F: main (pruebas_chanutron.c:707)
==8158==  Address 0x8 is not stack'd, malloc'd or (recently) free'd
==8158== 
[31;1m

ERROR MIENTRAS SE EJECUTABA LA PRUEBA: [33;1m'Si se intenta recorrer de manera INORDEN un abb NULL, se devuelve el valor 0'

[37;1m==8158== 
==8158== HEAP SUMMARY:
==8158==     in use at exit: 32 bytes in 1 blocks
==8158==   total heap usage: 2 allocs, 1 frees, 4,128 bytes allocated
==8158== 
==8158== 32 bytes in 1 blocks are still reachable in loss record 1 of 1
==8158==    at 0x4846828: malloc (in /usr/libexec/valgrind/vgpreload_memcheck-amd64-linux.so)
==8158==    by 0x118241: crear_array (pruebas_abb.c:46)
==8158==    by 0x118241: recorrer_abb_nulo (pruebas_abb.c:812)
==8158==    by 0x123B2F: pruebas_recorridos_array (pruebas_abb.c:1617)
==8158==    by 0x12403E: pruebas_abril (pruebas_abb.c:1650)
==8158==    by 0x10969F: main (pruebas_chanutron.c:707)
==8158== 
==8158== LEAK SUMMARY:
==8158==    definitely lost: 0 bytes in 0 blocks
==8158==    indirectly lost: 0 bytes in 0 blocks
==8158==      possibly lost: 0 bytes in 0 blocks
==8158==    still reachable: 32 bytes in 1 blocks
==8158==         suppressed: 0 bytes in 0 blocks
==8158== 
==8158== For lists of detected and suppressed errors, rerun with: -s
==8158== ERROR SUMMARY: 1 errors from 1 contexts (suppressed: 0 from 0)
[33;1m
Recorrer con un array nulo y con tamanio cero
=============================================[37;1m
==8159== Invalid read of size 8
==8159==    at 0x10A17F: interna_inorden_recursivo (abb_internas.c:42)
==8159==    by 0x109F29: abb_iterar_inorden (abb.c:192)
==8159==    by 0x109F29: abb_vectorizar_inorden (abb.c:236)
==8159==    by 0x1185AD: recorrer_con_array_nulo (pruebas_abb.c:834)
==8159==    by 0x123B4F: pruebas_recorridos_array (pruebas_abb.c:1619)
==8159==    by 0x12403E: pruebas_abril (pruebas_abb.c:1650)
==8159==    by 0x10969F: main (pruebas_chanutron.c:707)
==8159==  Address 0x8 is not stack'd, malloc'd or (recently) free'd
==8159== 
[31;1m

ERROR MIENTRAS SE EJECUTABA LA PRUEBA: [33;1m'Si se intenta recorrer de manera INORDEN un abb válido con un array nulo, se devuelve 0'

[37;1m==8159== 
==8159== HEAP SUMMARY:
==8159==     in use at exit: 24 bytes in 1 blocks
==8159==   total heap usage: 2 allocs, 1 frees, 4,120 bytes allocated
==8159== 
==8159== 24 bytes in 1 blocks are still reachable in loss record 1 of 1
==8159==    at 0x484D953: calloc (in /usr/libexec/valgrind/vgpreload_memcheck-amd64-linux.so)
==8159==    by 0x10993B: abb_crear (abb.c:12)
==8159==    by 0x118523: recorrer_con_array_nulo (pruebas_abb.c:832)
==8159==    by 0x123B4F: pruebas_recorridos_array (pruebas_abb.c:1619)
==8159==    by 0x12403E: pruebas_abril (pruebas_abb.c:1650)
==8159==    by 0x10969F: main (pruebas_chanutron.c:707)
==8159== 
==8159== LEAK SUMMARY:
==8159==    definitely lost: 0 bytes in 0 blocks
==8159==    indirectly lost: 0 bytes in 0 blocks
==8159==      possibly lost: 0 bytes in 0 blocks
==8159==    still reachable: 24 bytes in 1 blocks
==8159==         suppressed: 0 bytes in 0 blocks
==8159== 
==8159== For lists of detected and suppressed errors, rerun with: -s
==8159== ERROR SUMMARY: 1 errors from 1 contexts (suppressed: 0 from 0)
[33;1m
Recorrer un abb válido
=======================[37;1m
==8160== Invalid read of size 8
==8160==    at 0x10A17F: interna_inorden_recursivo (abb_internas.c:42)
==8160==    by 0x109F29: abb_iterar_inorden (abb.c:192)
==8160==    by 0x109F29: abb_vectorizar_inorden (abb.c:236)
==8160==    by 0x1188B7: recorrer_un_abb_vacio (pruebas_abb.c:852)
==8160==    by 0x123B38: pruebas_recorridos_array (pruebas_abb.c:1622)
==8160==    by 0x12403E: pruebas_abril (pruebas_abb.c:1650)
==8160==    by 0x10969F: main (pruebas_chanutron.c:707)
==8160==  Address 0x8 is not stack'd, malloc'd or (recently) free'd
==8160== 
[31;1m

ERROR MIENTRAS SE EJECUTABA LA PRUEBA: [33;1m'Si se intenta recorrer de manera INORDEN un abb vacío, se devuelve 0'

[37;1m==8160== 
==8160== HEAP SUMMARY:
==8160==     in use at exit: 56 bytes in 2 blocks
==8160==   total heap usage: 3 allocs, 1 frees, 4,152 bytes allocated
==8160== 
==8160== 24 bytes in 1 blocks are still reachable in loss record 1 of 2
==8160==    at 0x484D953: calloc (in /usr/libexec/valgrind/vgpreload_memcheck-amd64-linux.so)
==8160==    by 0x10993B: abb_crear (abb.c:12)
==8160==    by 0x118836: recorrer_un_abb_vacio (pruebas_abb.c:850)
==8160==    by 0x123B38: pruebas_recorridos_array (pruebas_abb.c:1622)
==8160==    by 0x12403E: pruebas_abril (pruebas_abb.c:1650)
==8160==    by 0x10969F: main (pruebas_chanutron.c:707)
==8160== 
==8160== 32 bytes in 1 blocks are still reachable in loss record 2 of 2
==8160==    at 0x4846828: malloc (in /usr/libexec/valgrind/vgpreload_memcheck-amd64-linux.so)
==8160==    by 0x118827: crear_array (pruebas_abb.c:46)
==8160==    by 0x118827: recorrer_un_abb_vacio (pruebas_abb.c:849)
==8160==    by 0x123B38: pruebas_recorridos_array (pruebas_abb.c:1622)
==8160==    by 0x12403E: pruebas_abril (pruebas_abb.c:1650)
==8160==    by 0x10969F: main (pruebas_chanutron.c:707)
==8160== 
==8160== LEAK SUMMARY:
==8160==    definitely lost: 0 bytes in 0 blocks
==8160==    indirectly lost: 0 bytes in 0 blocks
==8160==      possibly lost: 0 bytes in 0 blocks
==8160==    still reachable: 56 bytes in 2 blocks
==8160==         suppressed: 0 bytes in 0 blocks
==8160== 
==8160== For lists of detected and suppressed errors, rerun with: -s
==8160== ERROR SUMMARY: 1 errors from 1 contexts (suppressed: 0 from 0)
[33;1m
Recorrer un abb válido, modificarlo y volver a recorrerlo
==========================================================[37;1m
[32;1m✓ [37;1mEs posible insertar en un nuevo abb
[32;1m✓ [37;1mEl abb posee 1 elemento
[32;1m✓ [37;1mEl abb no está vacío
[31;1m✗ [37;1mSe recorre el abb y se almacena la cantidad correcta de elementos
[32;1m✓ [37;1mEl elemento almacenado es el correcto
[32;1m✓ [37;1mSe insertaron varios elementos. Ahora el abb posee 6 elementos
[32;1m✓ [37;1mEl abb no está vacío
[31;1m✗ [37;1mSe vuelve a recorrer el abb y se almacena la nueva cantidad correcta de elementos
[32;1m✓ [37;1mEl primer elemento es el correcto
[32;1m✓ [37;1mEl segundo elemento es el correcto
[32;1m✓ [37;1mEl tercer elemento es el correcto
[32;1m✓ [37;1mEl cuarto elemento es el correcto
[32;1m✓ [37;1mEl quinto elemento es el correcto
[32;1m✓ [37;1mEl sexto elemento es el correcto
[32;1m✓ [37;1mSe inserta un nuevo elemento en el abb, más chico que el menor anterior
[32;1m✓ [37;1mSe inserta un elemento repetido en el abb
[32;1m✓ [37;1mSe inserta un nuevo elemento máximo en el abb, mayor al más grande anterior
[32;1m✓ [37;1mSe insertaron varios elementos. Ahora el abb posee 9 elementos
[32;1m✓ [37;1mEl abb no está vacío
[31;1m✗ [37;1mSe vuelve a recorrer el abb y se almacena la nueva cantidad correcta de elementos
[32;1m✓ [37;1mEl primer elemento es el correcto
[32;1m✓ [37;1mEl segundo elemento es el correcto
[32;1m✓ [37;1mEl tercer elemento es el correcto
[32;1m✓ [37;1mEl cuarto elemento es el correcto
[32;1m✓ [37;1mEl quinto elemento es el correcto
[32;1m✓ [37;1mEl sexto elemento es el correcto
[32;1m✓ [37;1mEl séptimo elemento es el correcto
[32;1m✓ [37;1mEl octavo elemento es el correcto
[32;1m✓ [37;1mEl noveno elemento es el correcto
[32;1m✓ [37;1mTengo un nuevo abb. Su tamaño es 16
[31;1m✗ [37;1mSe recorre el abb y se almacena la cantidad correcta de elementos
[32;1m✓ [37;1mEl 1º elemento almacenado es el correcto
[32;1m✓ [37;1mEl 2º elemento almacenado es el correcto
[32;1m✓ [37;1mEl 3º elemento almacenado es el correcto
[32;1m✓ [37;1mEl 4º elemento almacenado es el correcto
[32;1m✓ [37;1mEl 5º elemento almacenado es el correcto
[32;1m✓ [37;1mEl 6º elemento almacenado es el correcto
[32;1m✓ [37;1mEl 7º elemento almacenado es el correcto
[32;1m✓ [37;1mEl 8º elemento almacenado es el correcto
[32;1m✓ [37;1mEl 9º elemento almacenado es el correcto
[32;1m✓ [37;1mEl 10º elemento almacenado es el correcto
[32;1m✓ [37;1mEl 11º elemento almacenado es el correcto
[32;1m✓ [37;1mEl 12º elemento almacenado es el correcto
[32;1m✓ [37;1mEl 13º elemento almacenado es el correcto
[32;1m✓ [37;1mEl 14º elemento almacenado es el correcto
[32;1m✓ [37;1mEl 15º elemento almacenado es el correcto
[32;1m✓ [37;1mEl 16º elemento almacenado es el correcto
[32;1m✓ [37;1mEs posible quitar la raiz
[32;1m✓ [37;1mEl elemento devuelto es el esperado (0x1fff000444 == 0x1fff000444).
[31;1m✗ [37;1mSe recorre el abb y se almacena la cantidad correcta de elementos
[32;1m✓ [37;1mEl 1º elemento almacenado es el correcto
[32;1m✓ [37;1mEl 2º elemento almacenado es el correcto
[32;1m✓ [37;1mEl 3º elemento almacenado es el correcto
[32;1m✓ [37;1mEl 4º elemento almacenado es el correcto
[32;1m✓ [37;1mEl 5º elemento almacenado es el correcto
[31;1m✗ [37;1mEl 6º elemento almacenado es el correcto
[31;1m✗ [37;1mEl 7º elemento almacenado es el correcto
[31;1m✗ [37;1mEl 8º elemento almacenado es el correcto
[31;1m✗ [37;1mEl 9º elemento almacenado es el correcto
[31;1m✗ [37;1mEl 10º elemento almacenado es el correcto
[31;1m✗ [37;1mEl 11º elemento almacenado es el correcto
[31;1m✗ [37;1mEl 12º elemento almacenado es el correcto
[31;1m✗ [37;1mEl 13º elemento almacenado es el correcto
[31;1m✗ [37;1mEl 14º elemento almacenado es el correcto
[31;1m✗ [37;1mEl 15º elemento almacenado es el correcto
[32;1m✓ [37;1mEs posible quitar un elemento que solo tiene hijo izquierdo, sin nietos
[32;1m✓ [37;1mEl elemento devuelto es el esperado (0x1fff000434 == 0x1fff000434).
[31;1m✗ [37;1mSe recorre el abb y se almacena la cantidad correcta de elementos
[32;1m✓ [37;1mEl 1º elemento almacenado es el correcto
[32;1m✓ [37;1mEl 2º elemento almacenado es el correcto
[32;1m✓ [37;1mEl 3º elemento almacenado es el correcto
[32;1m✓ [37;1mEl 4º elemento almacenado es el correcto
[31;1m✗ [37;1mEl 5º elemento almacenado es el correcto
[31;1m✗ [37;1mEl 6º elemento almacenado es el correcto
[31;1m✗ [37;1mEl 7º elemento almacenado es el correcto
[31;1m✗ [37;1mEl 8º elemento almacenado es el correcto
[31;1m✗ [37;1mEl 9º elemento almacenado es el correcto
[31;1m✗ [37;1mEl 10º elemento almacenado es el correcto
[31;1m✗ [37;1mEl 11º elemento almacenado es el correcto
[31;1m✗ [37;1mEl 12º elemento almacenado es el correcto
[31;1m✗ [37;1mEl 13º elemento almacenado es el correcto
[32;1m✓ [37;1mEl 14º elemento almacenado es el correcto
[32;1m✓ [37;1mEs posible quitar un elemento que tiene dos hijos y varios nietos
[32;1m✓ [37;1mEl elemento devuelto es el esperado (0x1fff00045c == 0x1fff00045c).
[31;1m✗ [37;1mSe recorre el abb y se almacena la cantidad correcta de elementos
[32;1m✓ [37;1mEl 1º elemento almacenado es el correcto
[32;1m✓ [37;1mEl 2º elemento almacenado es el correcto
[32;1m✓ [37;1mEl 3º elemento almacenado es el correcto
[32;1m✓ [37;1mEl 4º elemento almacenado es el correcto
[31;1m✗ [37;1mEl 5º elemento almacenado es el correcto
[31;1m✗ [37;1mEl 6º elemento almacenado es el correcto
[31;1m✗ [37;1mEl 7º elemento almacenado es el correcto
[31;1m✗ [37;1mEl 8º elemento almacenado es el correcto
[31;1m✗ [37;1mEl 9º elemento almacenado es el correcto
[31;1m✗ [37;1mEl 10º elemento almacenado es el correcto
[31;1m✗ [37;1mEl 11º elemento almacenado es el correcto
[31;1m✗ [37;1mEl 12º elemento almacenado es el correcto
[32;1m✓ [37;1mEl 13º elemento almacenado es el correcto
[32;1m✓ [37;1mEs posible quitar un elemento que solo tiene hijo izquierdo, con nietos
[32;1m✓ [37;1mEl elemento devuelto es el esperado (0x1fff000454 == 0x1fff000454).
[31;1m✗ [37;1mSe recorre el abb y se almacena la cantidad correcta de elementos
[32;1m✓ [37;1mEl 1º elemento almacenado es el correcto
[32;1m✓ [37;1mEl 2º elemento almacenado es el correcto
[32;1m✓ [37;1mEl 3º elemento almacenado es el correcto
[32;1m✓ [37;1mEl 4º elemento almacenado es el correcto
[31;1m✗ [37;1mEl 5º elemento almacenado es el correcto
[31;1m✗ [37;1mEl 6º elemento almacenado es el correcto
[31;1m✗ [37;1mEl 7º elemento almacenado es el correcto
[31;1m✗ [37;1mEl 8º elemento almacenado es el correcto
[31;1m✗ [37;1mEl 9º elemento almacenado es el correcto
[31;1m✗ [37;1mEl 10º elemento almacenado es el correcto
[31;1m✗ [37;1mEl 11º elemento almacenado es el correcto
[32;1m✓ [37;1mEl 12º elemento almacenado es el correcto
[32;1m✓ [37;1mEs posible quitar un elemento que solo tiene hijo dercho, con nietos
[32;1m✓ [37;1mEl elemento devuelto es el esperado (0x1fff000460 == 0x1fff000460).
[31;1m✗ [37;1mSe recorre el abb y se almacena la cantidad correcta de elementos
[32;1m✓ [37;1mEl 1º elemento almacenado es el correcto
[32;1m✓ [37;1mEl 2º elemento almacenado es el correcto
[32;1m✓ [37;1mEl 3º elemento almacenado es el correcto
[32;1m✓ [37;1mEl 4º elemento almacenado es el correcto
[31;1m✗ [37;1mEl 5º elemento almacenado es el correcto
[31;1m✗ [37;1mEl 6º elemento almacenado es el correcto
[31;1m✗ [37;1mEl 7º elemento almacenado es el correcto
[31;1m✗ [37;1mEl 8º elemento almacenado es el correcto
[31;1m✗ [37;1mEl 9º elemento almacenado es el correcto
[31;1m✗ [37;1mEl 10º elemento almacenado es el correcto
[32;1m✓ [37;1mEl 11º elemento almacenado es el correcto
[32;1m✓ [37;1mEs posible quitar un elemento que tiene hijo izquierdo y derecho, sin nietos
[32;1m✓ [37;1mEl elemento devuelto es el esperado (0x1fff000438 == 0x1fff000438).
[31;1m✗ [37;1mSe recorre el abb y se almacena la cantidad correcta de elementos
[32;1m✓ [37;1mEl 1º elemento almacenado es el correcto
[32;1m✓ [37;1mEl 2º elemento almacenado es el correcto
[32;1m✓ [37;1mEl 3º elemento almacenado es el correcto
[31;1m✗ [37;1mEl 4º elemento almacenado es el correcto
[31;1m✗ [37;1mEl 5º elemento almacenado es el correcto
[31;1m✗ [37;1mEl 6º elemento almacenado es el correcto
[31;1m✗ [37;1mEl 7º elemento almacenado es el correcto
[31;1m✗ [37;1mEl 8º elemento almacenado es el correcto
[31;1m✗ [37;1mEl 9º elemento almacenado es el correcto
[32;1m✓ [37;1mEl 10º elemento almacenado es el correcto
[32;1m✓ [37;1mEs posible quitar un elemento que solo tiene hijo derecho, sin nietos
[32;1m✓ [37;1mEl elemento devuelto es el esperado (0x1fff000430 == 0x1fff000430).
[31;1m✗ [37;1mSe recorre el abb y se almacena la cantidad correcta de elementos
[32;1m✓ [37;1mEl 1º elemento almacenado es el correcto
[32;1m✓ [37;1mEl 2º elemento almacenado es el correcto
[31;1m✗ [37;1mEl 3º elemento almacenado es el correcto
[31;1m✗ [37;1mEl 4º elemento almacenado es el correcto
[31;1m✗ [37;1mEl 5º elemento almacenado es el correcto
[31;1m✗ [37;1mEl 6º elemento almacenado es el correcto
[31;1m✗ [37;1mEl 7º elemento almacenado es el correcto
[31;1m✗ [37;1mEl 8º elemento almacenado es el correcto
[32;1m✓ [37;1mEl 9º elemento almacenado es el correcto
[32;1m✓ [37;1mEs posible quitar la nueva raiz, que tiene hijos derecho e izquierdo
[32;1m✓ [37;1mEl elemento devuelto es el esperado (0x1fff000440 == 0x1fff000440).
[31;1m✗ [37;1mSe recorre el abb y se almacena la cantidad correcta de elementos
[32;1m✓ [37;1mEl 1º elemento almacenado es el correcto
[31;1m✗ [37;1mEl 2º elemento almacenado es el correcto
[31;1m✗ [37;1mEl 3º elemento almacenado es el correcto
[31;1m✗ [37;1mEl 4º elemento almacenado es el correcto
[31;1m✗ [37;1mEl 5º elemento almacenado es el correcto
[31;1m✗ [37;1mEl 6º elemento almacenado es el correcto
[31;1m✗ [37;1mEl 7º elemento almacenado es el correcto
[32;1m✓ [37;1mEl 8º elemento almacenado es el correcto
[32;1m✓ [37;1mEs posible quitar un elemento que tiene hijo izquierdo y derecho, con nietos
[32;1m✓ [37;1mEl elemento devuelto es el esperado (0x1fff000458 == 0x1fff000458).
[31;1m✗ [37;1mSe recorre el abb y se almacena la cantidad correcta de elementos
[32;1m✓ [37;1mEl 1º elemento almacenado es el correcto
[31;1m✗ [37;1mEl 2º elemento almacenado es el correcto
[31;1m✗ [37;1mEl 3º elemento almacenado es el correcto
[31;1m✗ [37;1mEl 4º elemento almacenado es el correcto
[31;1m✗ [37;1mEl 5º elemento almacenado es el correcto
[31;1m✗ [37;1mEl 6º elemento almacenado es el correcto
[32;1m✓ [37;1mEl 7º elemento almacenado es el correcto
[32;1m✓ [37;1mEs posible quitar la nueva raiz, que no tiene hijo izquierdo, así que la reemplaza su hijo derecho
[32;1m✓ [37;1mEl elemento devuelto es el esperado (0x1fff00043c == 0x1fff00043c).
[31;1m✗ [37;1mSe recorre el abb y se almacena la cantidad correcta de elementos
[31;1m✗ [37;1mEl 1º elemento almacenado es el correcto
[31;1m✗ [37;1mEl 2º elemento almacenado es el correcto
[31;1m✗ [37;1mEl 3º elemento almacenado es el correcto
[31;1m✗ [37;1mEl 4º elemento almacenado es el correcto
[31;1m✗ [37;1mEl 5º elemento almacenado es el correcto
[32;1m✓ [37;1mEl 6º elemento almacenado es el correcto
[31;1m✗ [37;1mEs posible quitar un elemento que no tiene hijos
[31;1m✗ [37;1mEl elemento devuelto es el esperado (0x1fff00043c == 0x1fff000448).
[31;1m✗ [37;1mSe recorre el abb y se almacena la cantidad correcta de elementos
[32;1m✓ [37;1mEl 1º elemento almacenado es el correcto
[32;1m✓ [37;1mEl 2º elemento almacenado es el correcto
[32;1m✓ [37;1mEl 3º elemento almacenado es el correcto
[32;1m✓ [37;1mEl 4º elemento almacenado es el correcto
[32;1m✓ [37;1mEl 5º elemento almacenado es el correcto
==8161== 
==8161== HEAP SUMMARY:
==8161==     in use at exit: 24 bytes in 1 blocks
==8161==   total heap usage: 30 allocs, 29 frees, 5,136 bytes allocated
==8161== 
==8161== 24 bytes in 1 blocks are definitely lost in loss record 1 of 1
==8161==    at 0x484D953: calloc (in /usr/libexec/valgrind/vgpreload_memcheck-amd64-linux.so)
==8161==    by 0x10A11B: crear_nodo (abb_internas.c:6)
==8161==    by 0x10A11B: interna_insertar (abb_internas.c:17)
==8161==    by 0x1099DC: abb_insertar (abb.c:47)
==8161==    by 0x11BBDB: recorrer_array_y_eliminar_elementos_al_abb (pruebas_abb.c:1117)
==8161==    by 0x123B05: pruebas_recorridos_array (pruebas_abb.c:1628)
==8161==    by 0x12403E: pruebas_abril (pruebas_abb.c:1650)
==8161==    by 0x10969F: main (pruebas_chanutron.c:707)
==8161== 
==8161== LEAK SUMMARY:
==8161==    definitely lost: 24 bytes in 1 blocks
==8161==    indirectly lost: 0 bytes in 0 blocks
==8161==      possibly lost: 0 bytes in 0 blocks
==8161==    still reachable: 0 bytes in 0 blocks
==8161==         suppressed: 0 bytes in 0 blocks
==8161== 
==8161== For lists of detected and suppressed errors, rerun with: -s
==8161== ERROR SUMMARY: 1 errors from 1 contexts (suppressed: 0 from 0)
==8157== 
==8157== HEAP SUMMARY:
==8157==     in use at exit: 0 bytes in 0 blocks
==8157==   total heap usage: 1 allocs, 1 frees, 4,096 bytes allocated
==8157== 
==8157== All heap blocks were freed -- no leaks are possible
==8157== 
==8157== For lists of detected and suppressed errors, rerun with: -s
==8157== ERROR SUMMARY: 0 errors from 0 contexts (suppressed: 0 from 0)
[37;1m
---------------------------------
361 pruebas corridas, 104 errores - D:
[0m==8129== 
==8129== HEAP SUMMARY:
==8129==     in use at exit: 0 bytes in 0 blocks
==8129==   total heap usage: 1 allocs, 1 frees, 4,096 bytes allocated
==8129== 
==8129== All heap blocks were freed -- no leaks are possible
==8129== 
==8129== For lists of detected and suppressed errors, rerun with: -s
==8129== ERROR SUMMARY: 0 errors from 0 contexts (suppressed: 0 from 0)
make: *** [makefile-chanutron:8: valgrind] Error 2

[1;31m¡ERROR CORRIENDO VALGRIND! Revisa tu entrega, las pruebas de la CÁTEDRA no pasan.[0m

